,text,label
0,Vålerenga - Rosenborg 2-3,Ignore
1,"Sam Johnson ga vertene ledelsen, men Jonathan Levi og et selvmål av Enar Jääger snudde kampen, før tidligere Brann-spiller Amin Nouri ordnet 2-2 med mål i sin andre strake (!) hjemmekamp.",Goal/Assist
2,På et hjørnespark langt på overtid kom avgjørelsen for Rosenborg da et hjørnespark havnet hos nysigneringen Jebali på bakerste stolpe.,Goal/Assist
3,Ti minutter før pause scoret Sam Johnson sitt første mål siden midten av mai da han dro seg fint inn fra venstre og curlet ballen i det lengste hjørnet via Hedenstad.,Goal/Assist
4,Vålerenga holdt 1-0-ledelsen bare frem til siste spilleminutt av omgangen. Jonathan Levis halvvolley på utsiden av 16-meteren gikk via Bård Finne og overlistet keeper Adam Larsen Kwarasey på hjemmelaget.,Goal/Assist
5,Andreomgang var bare drøyt fire minutter gammel da Rosenborg hadde snudd kampen. Hedenstads hjørnespark ble slått hardt på første stolpe. Enar Jääger var uheldig og headet ballen i eget mål.,Goal/Assist
6,"Det varte imidlertid ikke lenge, for i det 58. spilleminutt havnet en retur fra André Hansen i beina på Amin Nouri, som banket inn 2-2 for Vålerenga. Dermed har høyrebacken scoret i to strake hjemmekamper.",Goal/Assist
7,Nesten fem minutter på overtid kom avgjørelsen da Jebali snek seg inn på bakerste stolpe på hjørnespark og med en velplassert volley styrte inn 3-2.,Goal/Assist
8,Enar Jääger og Mohammed Abu måtte for øvrig ut med skade for VIF.,Injuries
9,Se målene i Sportsnyhetene øverst.,Ignore
10,Avgjørelsen falt da Ruud bøyde et frispark over muren og i venstre kryss sju minutter etter pause.,Goal/Assist
11,Sarpsborgs poengfangst i Eliteserien har stoppet helt. Espen Ruud scoret begge Odds mål i 2-1-seieren i Østfold søndag.,Goal/Assist
12,Se Besiktas mot Sarpsborg på TV 2 Sport 1 og Sumo torsdag fra kl. 18.15.,Ignore
13,Espen Ruuds frisparkfot hylles etter at han ble matchvinner mot Sarpsborg.,Player details
14,"I siste spilleminutt hadde Samúel Kari Fridjónsson en god mulighet på frispark, men Rosenborg-målvakt André Hansen fikk slått unna.",sjanse
15,Rosenborg er tilbake på toppen av Eliteserien etter at Brann lånte den i et drøyt døgn etter 3-1 over Haugesund.,Club details
16,Rosenborg leder to poeng foran Brann. Vålerenga er nummer seks med fem poeng opp til Haugesund på tredjeplass.,Club details
17,"– Bittert. Det er mye mer bittert enn å tape drittkamp der du blir rundspilt og ikke fortjener noe, men i dag var det glød i øynene på gutta. Det var tro, hardt arbeid og masse offensivt spill. Det var en herlig ramme med fantastiske
                        supportere, sier Vålerenga-trener Ronny Deila til TV 2.",quote
18,"– Det var en fantastisk avslutning. Vi var slitne og det var en vanskelig kamp, sier matchvinneren til TV Norge.​",quote
19,"Bård Finne skapte kampens første store mulighet da han snappet ballen fra Vegard Eggen Hedenstad, dro seg inn i banen og fyrte av, men ballen gikk i stolpen.",sjanse
20,"I det 48. minutt klarte endelig Sarpsborg å bryte seg gjennom Odd-forsvaret. Heinz utnyttet Vegard Bergans balltap på egen banehalvdel og spilte videre til Thomassen. S08-kapteinen dro seg innover i boksen og hamret inn 1-1 i venstre
                        hjørne.",Goal/Assist
21,"Gleden på et regnfylt Sarpsborg stadion varte ikke lenge. Bare fire minutter senere prikket Ruud inn vinnermålet på frispark. Amin Askar hoppet desperat på streken, men kom ikke høyt nok opp.",Goal/Assist
22," Se begge målene i Sportsnyhetene øverst. 

",Ignore
23,Hjemmelagets Andreas Helmerens sendte vertene i ledelsen etter 28 minutter og trodde nok at han hadde blitt matchvinner.,Goal/Assist
24,"Kvarteret før slutt burde Birk Risa punktert oppgjøret for Odd. Etter et Ruud-frispark løp Risa seg fri og fikk stå helt alene, men fra fem meter skjøt han ballen utenfor mål.",sjanse
25,Sarpsborg innleder torsdag sitt gruppespilleventyr i europaligaen med bortekamp mot tyrkiske Besiktas i Istanbul. Der må sarpingene regne med at det blir skikkelig kok.,Club details
26,Odd er litt i dytten om dagen. Telemarkingene er ubeseiret på sine sju siste seriekamper. Odds forrige tap kom mot Tromsø 1. juli. Dag-Eilev Fagermos menn står med 30 poeng. Det er to poeng mindre enn Sarpsborg.,Club details
27,(©NTB),Ignore
28,Ranheim-Strømsgodset 1-1,Ignore
29,Rossbachs redning av Heinz-forsøket var imponerende. Han måtte rygge bakover mot eget mål før han kastet seg bakover og fikk ballen unna.,sjanse
30,Ranet med seg ett poeng i Ranheim: – De må passe seg,Club details
31,Strømsgodset ranet til seg uavgjort på overtid. Det er ett poeng som kan vise seg å bli livsviktig i kampen for å unngå nedrykk.,Club details
32,Strømsgodset lå lenge an til å tape 0-1 borte for Ranheim søndag.,Club details
33,Så dukket Tokmac Nguen opp to minutter på overtid og reddet et svært viktig poeng for drammenserne.,irrelevant
34,"Med Start-seier og Stabæk-poeng har Strømsgodset dermed plutselig begge bein godt plantet i bunnstriden, kun fire poeng over direkte nedrykk.",Club details
35,"
                    – Dette ene poenget kan vise seg å bli svært viktig for dem. ",quote
36,"For til tross for et viktig bortepoeng, er sannheten at Strømsgodset nok en gang underpresterte, mener TV 2s fotballekspert Jesper Mathisen.",irrelevant
37,"Drammenserne har ikke vunnet på fem kamper, og nå venter Molde, Sarpsborg 08 og Haugesund de neste tre rundene.",Club details
38,"– Det er helt nifst å se dette Strømsgodset-laget. Med alle de gode spillerne vet vi hva de kan gjøre på sitt beste. Se laget, stallen og banken. At ikke de kan skape mål, sjanser og vinne kamper, er helt utrolig, sier Jesper Mathisen
                        i FotballXtra.",quote
39,– De skal passe seg nå hvis de ikke klarer å heve seg.,quote
40,Steffen Iversen etterlyser mer støtte til Marcus Pedersen på topp.,irrelevant
41,"– Selv om de har Marcus Pedersen med 14 mål allerede, trenger han mer støtte som spiss. De trenger at midtbanespillerne kommer opp og at ikke alt blir liggende på skuldrene til Marcus, sier Steffen Iversen.",quote
42,Bjørn Petter Ingebretsen tok over som hovedtrener for Strømsgodset i sommer etter at Tor Ole Skullerud tok konsekvensen av en rekke dårlige resultater. Etter en brukbar start har imidlertid fremgangen uteblitt.,irrelevant
43,John Arne Riise var ukens gjest i FotballXtra. Han er bekymret for at drammenserne har trent for dårlig.,irrelevant
44,"– Jeg vet ikke hva de gjør hele uken på trening. I fotball er det lett å skylde på ting, men også at det blir for rolig på trening. At man ikke trener hardt nok. Det er ikke noe man merker med en gang, men du blir straffet til slutt.
                        Det kan ikke snus bare på en helg. Det tar lang tid å få tilbake. De har trent for dårlig og hatt for dårlig fokus på treningsarbeidet. Det er et eller annet som ikke stemmer, sier John Arne Riise.",quote
45,"– De gjør for mange personlige feil og blir straffet hver gang. Jeg husker de spilte fantastisk fotball og det kom en bølge med løp. Alt går feil vei nå, og selvfølgelig har fått seg en knekk. Det skal du ikke kimse av, det har ekstremt
                        mye å si i fotball.",quote
46,"Et skår i gleden for bursdagsbarnet Pellegrini var at Marko Arnautovic, som til tider terroriserte Everton-forsvaret, måtte forlate banen med en skade etter 65 minutter. Da hadde han nettopp scoret West Hams 3-1-mål.​",Injuries
47,"– Det er blytungt for Lillestrøm, som går på et tap, får Amundsen utvist og Erling Knudtzon går ut med skade, sier TV 2s fotballekspert Jesper Mathisen.",Injuries
48," Se kampsammendraget i videovinduet øverst. 

",Ignore
49," Se målene i Sportsnyhetene øverst!
",Ignore
50,"Mot Lillestrøm kom den endelig da han på nydelig vis satte inn 1-0, og i andreomgang hadde han muligheter til å score enda flere. Kevin Kabran doblet fra straffemerket, før Mathias Bringaker la på 3-0 etter pause.",Goal/Assist
51,"Adeleke Akinyemi ble hentet for om lag ti millioner kroner fra Ventspils i august, men scoringene har latt vente på seg.",Transfer
52,"Allerede etter fem minutters spill tok Start ledelsen ved Akinyemi, som rundlurte Marius Amundsen og satte inn 1-0 for kristiansanderne.",Goal/Assist
53,Kevin Kabran var sikker og satte inn 2-0 mot Lillestrøm med ti spillere.,Goal/Assist
54,"– Han har vist at han duger, sier TV 2s fotballekspert Jesper Mathisen.",quote
55,Start - Lillestrøm 3-0,Ignore
56,"Start tok en livsviktig 3-0-seier mot Lillestrøm, som måtte spille store deler av kampen med ti spillere etter utvisningen av Marius Amundsen etter 19 minutter.",Rodt/gult kort
57,"– Vi er ikke tre mål bedre enn Lillestrøm, men tilfeldighetene gjorde det sånn, sier Start-trener Kjetil Rekdal til Eurosport.",quote
58,"– Det var en kamp som var utrolig spesiell. Det skjer utrolig mye det første kvarteret, og det som skjer der blir avgjørende for kamp. En marerittstart for vår del med målene, straffen, rødt kort og Erling Knudtzon skadet på bare ti minutter, sier LSK-trener Jörgen Lennartsson til TV 2.",quote
59,Resultatet gjør at Start går forbi nettopp Lillestrøm og opp på kvalifiseringsplass. Lillestrøm ligger nå på direkte nedrykk.,Club details
60,"– Adeleke Akinyemi har vært lovende i perioder i enkelte kamper, men målene har manglet. Han var nær sist. Han scoret mye i Europaliga-kvaliken for sin forrige klubb, så han har vist at han duger. Alle som er glade i Kristiansand, Sørlandet og Start håper han er målscoreren Start har trengt, sier TV 2s fotballekspert Jesper Mahtisen.",quote
61,"– Mannen som ble hentet for mange, mange millioner på overgangsvinduets siste dag har startet nedbetalingen. Det er en strålende prestasjon. Han kjørte karusell med en Lillestrøm-forsvarer. Marius Amundsen forsvant langt ut på den
                        glatte banen i Kristiansand, sa TV 2s ekspert Jesper Mathisen i FotballXtra-studio.",quote
62,"Ti minutter senere hadde Marcus Pedersen en avslutning i tverrliggeren, men i det Lillestrøm presset på for utligning, ble Herolind Shala lagt i bakken av Marius Amundsen innenfor 16-meteren.",sjanse
63,"Start fikk straffespark og Amundsen ble utvist, selv om det først var Simen Kind Mikalsen som feilaktig ble vist det røde kortet.",Rodt/gult kort
64,"– Helt korrekt. Så lenge det er holding, så er det ikke et ærlig forsøk, sier TV 2s fotballekspert Jesper Mathisen.",quote
65,"Douglas Costa svarte med å sette albuen i ansiktet på Di Francesco, før han skallet til Sassuolo-spilleren. Costa var heldig og fikk først kun gult kort av dommeren.",Rodt/gult kort
66,"Venstrebacken satt knottene i bakhodet på Theo Walcott, men dommer nøyde seg med et gult kort.",Rodt/gult kort
67,Ukraineren fikk æren av å sette ballen i det tomme nettet i sin første Premier League-start.,Goal/Assist
68,"Flott scoring, men fryktelig svakt av Evertons målvakt.",Goal/Assist
69,"Det var Everton som hadde initiativet i kampen og presset på for scoring, men bakover lakk de som en sil.",Club details
70,"Juventus' innbytter, som var livlig etter å ha kommet innpå i andreomgang, ble taket hardt av Federico Di Francesco i forkant av Sassuolos redusering til 1-2.",Goal/Assist
71,På overtid av første omgang fikk blåtrøyene sin redusering. Da hadde Marcos Silva nettopp gjort et offensivt bytte da Morgan Schneiderlin måtte vike vei for lille Bernard som ble hentet gratis i sommer.,Goal/Assist
72,"Evertons forsvarere trakk nok et lettelsens sukk da Arnautovic måtte forlate banen bare tre minutter etter scoringen. Spissen pådro seg en skade i en duell, og ble erstattet med Michail Antonio.",Injuries
73,Andreomgang startet like heseblesende som den første. Etter 60 minutter satt den igjen for bortelaget. Obiang og Arnautovic kombinerte nydelig enda en gang og åpnet opp Everton-forsvaret.,Goal/Assist
74,Cristiano Ronaldo måtte gå frustrert og målløs av banen i sine tre første kamper for Juventus etter sommerens overgang.,Player details
75,"– Jeg var litt engstelig, med alt som skjedde etter at jeg forlot Real Madrid for å komme hit, men det er slik livet er, sier Ronaldo etter kampen ifølge AS.",quote
76,– Det er menneskelig å være slik. Av og til kan vi ikke kontrollere angsten vår.,quote
77,"– Men jeg er fornøyd. Jeg vet at jeg jobbet godt, og at målene ville komme. Jeg setter pris på lagkameratene mine, som har hjulpet meg mye med å tilpasse meg den italienske serien.",quote
78,Endelig løsnet det for Ronaldo: Scoret to mål i Juventus-seier,Goal/Assist
79,"Det var en lettet Ronaldo som kunne juble for mål, men 33-åringen kunne og burde scoret enda flere i søndagens kamp.",Goal/Assist
80,"– Jeg ble overrasket av reaksjonen hans. Vi har sluppet inn et mål, fått et rødt kort og en suspensjon vil bli langvarig.",Rodt/gult kort
81,"I det 65. spilleminutt tok Juventus godt vare på en kontringsmulighet. Emre Can avanserte fremover og slapp ballen til Ronaldo, som fra litt skrått hold satte ballen i det lengste hjørnet til sitt andre mål for ettermiddagen.",Goal/Assist
82,"Et snaut kvarter før slutt burde Ronaldo ha fullført sitt hat-trick på innlegget fra Douglas Costa, men en svak avslutning gikk utenfor mål. Få minutter senere kunne han scoret igjen, men nok en gang skjøt han utenfor.",sjanse
83," Se målene i Sportsnyhetene øverst!
",Ignore
84,Se skrekkskaden i Sportsnyhetene øverst.,Ignore
85,Juventus - Sassuolo 2-1,Ignore
86,"På overtid kokte det over i Torino. Khouma Babacar headet først inn 1-2-reduseringen for gjestene, men det kom for sent.",Goal/Assist
87,"Så kokte det over for Douglas Costa i en situasjon like før reduseringen. Etter å ha blitt taklet av Federico Di Francesco, satte Costa albuen i Di Francesco, før han skallet mot Sassuolo-spilleren. Før avspark spyttet han på Di Francesco,
                        og det hele endte med at han ble utvist like før kampslutt.",Rodt/gult kort
88,"Juventus, som har vunnet ligaen de sju siste sesongene, topper Serie A med full pott etter fire runder. Napoli følger på andreplass med ni poeng etter like mange kamper.",Club details
89,"De siste to årene, i Nordsjælland, har nemlig vært tunge. Fellah har knapt spilt kamper. Sist han startet en kamp før Sandefjord-returen, var 27. september 2017.",Club drama
90,SANDEFJORD (VG) Han har slitt benken og følt seg glemt i hjemlandet. Som Sandefjord-spiller vil Mohamed Fellah (29) bevise for det norske folk at han fortsatt har det i seg.,Ignore
91,"– Jeg har ikke angret ett sekund, sier Fellah til VG.",Ignore
92,– Hvor ser du for deg selv de neste årene?,Transfer
93,"Nå håper Fellah at returen til norsk fotball og Sandefjord kan få fart på karrieren igjen. For selv om han har blitt 29 år, er teknikeren klar på at han har mer å komme med som fotballspiller.",Ignore
94,Revansjelysten Fellah har følt seg glemt: – Jeg har fortsatt mer å komme med,Personal drama
95,"Den kreative midtbanespilleren, som fikk med seg to A-landskamper for Norge i 2013, ble spådd en stor framtid i sine yngre dager. Men til tross for at han faktisk har 66 kamper i Superligaen på samvittigheten, har ikke karrieren skutt fart slik Fellah håpet på da han forlot Vålerenga til fordel for Esbjerg i 2013.",Player details
96,"Rosenborg-speider Hallvar Thoresen er mannen bak finsiktingen av Issam Jebali. Den gamle landslags- og PSV-kapteinen anbefalte sterkt at Rosenborg gjorde det de kunne for å få en avtale med tunisieren, som spilte i Elfsborg i Sverige.",irrelevant
97,"– Siden mars måned intensiverte vi interessen for Jebali. Så slo vi til. Men folk sa det var «årets bom-kjøp», sier Bjørnebye - ironisk.",quote
98,"– Det er helt sikkert 10 ganger opp og ned med fly den siste tiden, sier matchvinneren.",quote
99,Rosenborg går en hektisk periode i møte. Stig Inge Bjørnebye sier at klubben utelukkende ser på det tøffe kamp-programmet som positivt.,Ignore
100,Vinner selv på dårlige dager - se video under her: ,Ignore
101,"I en jevn og god kamp i Oslo søndag kveld, ble altså tunisieren nok en gang avgjørende. VIF tok ledelsen, Rosenborg utlignet - og gikk selv i ledelsen, før det så ut som Amin Nouris utligningsmål til 2–2 skulle bli det siste.",Goal/Assist
102,"– Da vi fikk corneren på overtid, så trodde jeg på seier, sier Stig Inge Bjørnebye. Og corneren ekspederte Issam Jebali i mål.",Ignore
103,"– Det er derfor de kjøpte meg, sier tunisieren. Han virker helt rolig av oppstyret, mener han vet hva han kan. Han er ikke overrasket over noen ting.",Ignore
104,"– Jeg visste at jeg kom til en klubb der det forventes titler. Og de fikk en spiller som forventer å vinne. Vi passer sammen, sier Jebali.",Ignore
105,Litt lenger bort i intervjusonen står hovedtrener Rini Coolen og snakker om det ene poenget som ble til tre. Alle har dårlig tid. Rosenborg skal rekke et fly.,Ignore
106,Det handler om å komme seg fort hjem. Sånn at de får maksimal oppladning til de neste kampene.,Ignore
107,Rosenborgs sportslige leder er svært imponert over det Jebali har prestert i svart og hvitt så langt. Fire mål på seks kamper lar seg høre. Og enda mer imponerende blir det når vi hører hva Jebali har drevet med den siste tiden: Han har nemlig vært mer i luften enn han har vært på bakken.,Goal/Assist
108,"– Jeg tror først det er Kind Mikalsen som gjør forseelsen, så jeg gir han gult kort først, så det røde, men får raskt på øret at jeg bommer på både farge og spiller. Siden det er en åpenbar scoringsmulighet er det klink rødt, sier Hobber Nilsen.",Rodt/gult kort
109,En scoring fra tidligere Brann-back Amin Nouri og en misbrukt kjempesjanse fra RBKs Yann-Erik de Lanlay i sluttminuttene - og det så ut som Brann og Rosenborg skulle stå like i poeng før de åtte siste kampene.,Goal/Assist
110,"Kampen levde, vippet. Så fikk RBK corner, fem minutter ut i 2. omgang, og presset av Anders Konradsen, stusset Enar Jääger balen i eget mål, uten mulighet for Adam Larsen Kwarasey.",Goal/Assist
111,"– Fra halvspilt sesong og ut, spiller vi dobbelt så mange kamper som Brann. Vi har minimum 15 kamper, kanskje både 16 og 17, mer enn Brann siden juli og ut sesongen. Men vi ser på dette som en fordel, sier Bjørnebye.",quote
112,"– Seriemesterskapet skal vi vinne, hører vi Rini Coolen si.",quote
113,"Og med matchvinnere som Issam Jebali i stallen, er det ikke sikkert at den påstanden blir feil til slutt.",irrelevant
114,"SØR ARENA (VG) (Start – Lillestrøm 3–0) I løpet av femten minutter fikk Lillestrøm straffe i mot seg, rødt kort, og Erling Knudtzon måtte ut med skade. Nå ligger gultrøyene under streken. LSK-trener Jørgen Lennartsson avfeier krise i klubben.",Injuries
115,Lillestrøm er nå under streken åtte runder før slutt. I bunnkampen i Kristiansand ble de knust 3–0. Marius Amundsen ble utvist og nøkkelspiller Erling Knudtzon måtte ut med skade. ,Injuries
116,Se situasjonen der dommer Hobber Nilsen gir rødt kort til feil spiller:,Ignore
117,Ivar Hoff har regnet seg fram til at kun åtte prosent av Norges befolkning husker at Lillestrøm ikke spilte i øverste divisjon. Han tror det antallet kan bli mye høyere i november.,Ignore
118,Lillestrøm har vært i bunnstriden de siste årene. Hoff sier at han venter på at det skal gå galt en dag.,Ignore
119,Han mener at kvaliteten på Start-Lillestrøm var som en OBOS-ligakamp.,Ignore
120, Se høydepunktene fra kampen mot Start: ,Ignore
121,"I Eurosports studio oppsummerte tidligere landslagskeeper, Thomas Myhre, Romerike-lagets innsats slik:",Ignore
122,Erling Knudtzon synes ikke Lillestrøm fortjente bedre i dag: ,Ignore
123,Ranet på overtid: – Spillene er utrolig skuffet,irrelevant
124,"RANHEIM (VG) (Ranheim-Strømsgodset 1–1) Med ett av de siste sparkene på ballen reddet Tokmac Nguen (24) poeng for Strømsgodset, og snudde glede til fortvilelse blant hjemmelagets spillere.",irrelevant
125,Ranheim så ut til å gå mot sin første seier på det nylagte kunstgresset. Men to minutter på overtid ødela en driblekonge fra Kenya moroa.,irrelevant
126,"– Spillerne er utrolig skuffet. Hva skal jeg kalle det? «Ransskuffet». Ikke over prestasjonen, for dette var opp imot det beste vi kan. Det så ut til å holde til tre poeng. Når vi først har seieren i lomma, to minutter på overtid, så skal vi greie å ri det unna, sier Ranheim-trener Svein Maalen, til VG.",quote
127,"Med ledelse 1–0 og et bortelag som tok stadig større sjanser offensivt, hadde hjemmelaget flust av sjanser til å drepe kampen med et kontringsmål.",irrelevant
128,Se hvordan Start senket LSK her:,Ignore
129,"– Kampen blir for oppjaga og vi har ballen altfor lite på slutten. Aller mest ligger det i at vi burde scoret 2-0 på en av de mange kontringsmulighetene vi hadde. Vi skal straffe dem mye hardere der, og ikke søle bort sjansene.",quote
130,"I stedet for at Ranheim punkterte kampen, fikk kampens store spiller, Tokmac Nguen, sin fjerde gode scoringsmulighet.",sjanse
131,"– Hvis det var noen som skulle score i denne kampen her, så var det meg. Jeg hadde mange sjanser, og burde scoret to til, sier Nguen til VG.",quote
132,Da det gjenstod ett minutt av overtiden fikk bortelaget en siste sjanse til å ta med seg et viktig bortepoeng.,irrelevant
133,"Klareringen fra Ranheim-forsvaret havnet hos feil person, for hjemmelagets del.",irrelevant
134,"– Jeg skjønte det med en gang jeg traff ballen med vrista at den kom til å gå inn. Det var et veldig viktig poeng, sier Nguen.",quote
135,Godset-leder Jostein Flo var også fornøyd med sin reddende kenyanske engel.,irrelevant
136,"Poenget gjør at «Godset» har tre poeng ned til Start, som ligger på kvalifiseringsplass.",Club details
137,"– Vi spilte en grei bortekamp, og hadde bra struktur defensivt. Vi har lett for å score mål, men slipper inn for mye mål. Jeg er godt fornøyd med ett poeng.",quote
138,Strømsgodset fikk en kanonstart på bortekampen. Før tre minutter var spilt hadde drammenserne kommet til tre gode avslutningsmuligheter. Nærmest var laget da Ranheim-back Aslak Fonn Witry reddet en avslutning på streken.,sjanse
139,"– Jeg så en åpning, og prøvde meg på lengste. Men så fikk én av dem en fot på ballen, sier Nguen, om den første sjansen.",quote
140,"Så fikk Ranheim endelig tak i ballen, og endret kampbildet totalt.",irrelevant
141,I de neste 87 minuttene handlet det meste om Ranheim.,irrelevant
142,"Sakte, men sikkert tok hjemmeballen kontroll over kampen, og tok seg god tid til å bygge opp angrep på angrep bakfra, slik laget har blitt kjent for – og hyllet for.",irrelevant
143,"En utoverskrudd Ranheim-corner landet på lengste, der Eirik Valla Dønnem fikk et kne på ballen. Ballen spratt inn mot målet, der Helmersen, som fikk sjansen i Michael Karlsens skadefravær, ventet.",sjanse
144,"Etter flere nesten-angrep som bare så vidt fikk hjemmefansen opp på beina, var spissreserve Andreas Helmersen på riktig sted til riktig tid.",irrelevant
145,"Helmersen hadde flere gode muligheter til å bli både to- og tremålsscorer, men enn så lenge stillingen sto seg på 1–0, var det håp om poeng for bortelaget.",sjanse
146,"Da håpet var i ferd med å renne ut i sanden, fikset Nguen biffen.",irrelevant
147,Nå er det kun en historisk bragd som kan berge plassen for Sandefjord,Club details
148,"– Ett poeng her er sannsynligvis ikke nok. Samtidig kan vi ikke slutte å tro. Vi har vist bedring hver eneste uke den siste tiden og kommer ikke til å gi oss før det er definitivt over, sier Sandefjord-trener Marti Cifuentes til VG.",quote
149,"Etter poengdelingen mot Bodø/Glimt har Sandefjord hele syv poeng opp til Start på kvalifiseringsplass. Hittil i år, på 22 kamper og åtte serierunder før sesongen er over, har Sandefjord bare plukket 13 poeng.",Club details
150,Lagets to neste bortekamper er mot gulljagende Brann og Rosenborg.,Club details
151,"I de ni foregående utgavene av Eliteserien, som alle har hatt 16 lag, har det aldri skjedd tidligere at et lag med så få poeng etter 22 serierunder har unngått nedrykk til 1. divisjon.",irrelevant
152,"– Så la oss være det første laget til å gjøre det da, sier Sandefjord-trener Cifuentes når han konfronteres med historikken av VG.",quote
153,– Hva taler for at dere skal snu det?,quote
154,"Sandefjords Mohamed Fellah, som vendte tilbake til norsk fotball i sommer, nekter å gi opp før det er matematisk umulig.",irrelevant
155,"– Man leser hele tida at ingen har troa, men jeg spiller her og har hundre prosent troen. Jeg spiller her og ser hvordan spillerne og trenerne jobber hver eneste dag. Jeg har troa helt fram til regnestykket sier at det er umulig å berge plassen, sier Fellah.",quote
156,Ohi irritert på Sandefjord:,irrelevant
157,I selve kampen mot Bodø/Glimt var det Mohamed Fellah og Sandefjord som tok initiativet fra start av. Det til tross for at et voldsomt regnskyll i Sandefjord gjorde det svært vanskelig å spille fotball spesielt i førsteomgang.,irrelevant
158,"–  Det ble litt mye parodi, spesielt i førsteomgang. Da var det vanskelig å spille fotball, sier Bodø/Glimt-trener Kjetil Knutsen, som dessuten undret seg dessuten over at det ble spilt en showkamp som oppladning til Eliteserie-oppgjøret.",quote
159,"– Jeg tror vel ikke akkurat at banen ble bedre av det, kommenterte Knutsen.",quote
160,"Selv om ballen tidvis stoppet opp og det ble vanskelig å sette fart framover, klarte Sandefjord å trille en del ball det første kvarteret. Hjemmelaget tok initiativet fra start av og allerede etter fem minutter ropte kaptein Håvard Storbæk etter straffespark etter et høyt spark i feltet, men dommer Trygve Kjensli vinket spillet videre.",irrelevant
161,To mål av Espen Ruud - og Sarpsborg gikk på sitt fjerde strake tap,Goal/Assist
