,text,label
1486,"Ifølge pressemeldingen har Bendtner vært i København for opptrening etter skade, og at han etter planen skal være tilbake i Trondheim i løpet av de første dagene denne uken. Da vil klubben gå gjennom det som har skjedd og vurdere hvilke konsekvenser hendelsen får for spilleren.",Injuries
1487,"En svak kamp fra Nice-spissen var med på å få begeret til å renne over. Balotelli, som også hinket av med en skade i låret, er én av sju spillere som ikke er å finne i troppen til Italia                        til mandagens kamp mot Portugal i Nations League.",Injuries
1488,"Nicklas har i noen dager vært i København for opptrening etter skade og skal etter planen være tilbake i Trondheim i løpet av de første dagene i denne uka. Vi vil da i fred og ro gå gjennom det som har skjedd og vurdere hvordan klubben
                        skal reagere. Vi vil behandle Nicklas på den måten han har krav på uansett handling.",Injuries
1489,Han har tidligere spilt for Lillestrøm og Molde før han gikk til Salzburg i 2016. 25-åringen har ikke vært på banen denne sesongen på grunn av en skade. ,Injuries
1490,"Mot LSK er Sam Adekugbe ute med karantene, og Näsberg blir antakelig brukt på venstrebacken med Felipe Carvalho tilbake fra skade, men Ronny Deila er klar på at det blir en konkurranse om midtstopper-plassen når alle er tilgjengelige for spill. ",Injuries
1491,"Sotiriou har vært ute med skade i 2,5 måned etter at han opererte lysken tidligere i sommer.",Injuries
1492,"Etter halvspilt andre omgang hadde Rosenborg-trener Rini Coolen sett nok, og tok tunisieren av banen, til fordel for Yann-Erik de Lanlay, som gjorde comeback etter skade.",Injuries
1493,"– Det er soleklar straffe og rødt kort. Han drar meg rett ned etter at jeg har avsluttet, sier Shala etter at VG har vist han situasjonen på video.",Rodt/gult kort
1494,"– Rashford reagerer litt voldsomt, men det er fullt mulig å bare gi gult kort der òg. Det er ganske strengt. Sparket til Bardsley er kanskje likestilt – han kunne gitt begge gult eller begge rødt, sa Osnes like etter utvisningen.",Rodt/gult kort
1495,"– Det spørs om jeg hadde gjort det samme om jeg hadde vært i samme situasjon, vi hadde ledet 1-0 og de kunne fått rødt kort. Kynisme kan vi bli bedre på vi også, medgir den utviste stopperen. ",Rodt/gult kort
1496,"Et skår i gleden var imidlertid at Nemanja Matic så rødt langt inne i overtiden. Serberen la Will Hughes i bakken på kynisk vis like før slutt, og fikk fullt fortjent se sitt andre gule kort for dagen. Dermed må han stå over hjemmeoppgjøret
                        mot Wolverhampton.",Rodt/gult kort
1497,"Phil Bardsley kom med en unødvendig etterslenger på Marcus Rashford, og sistnevnte svarte med å gå opp i ansiktet på den skotske høyrebacken og sette pannebrask mot pannebrask. Situasjonen minnet om da Richarlison (Everton-spiller) ble utvist forrige Premier League-runde, og resultatet var også det samme: direkte rødt kort.",Rodt/gult kort
1498,"– Rashford reagerer litt voldsomt, men det er fullt mulig å bare gi gult kort der òg. Det er ganske strengt. Sparket til Bardsley er kanskje likestilt – han kunne gitt begge gult, eller begge rødt, sa Osnes.",Rodt/gult kort
1499,"– Lars kom rett til meg og sa at jeg måtte ut fordi jeg hadde fått gult kort. Hvis jeg kommer inn igjen med gult kort, kan det fort bli rødt. Det er bare å se på hva som skjedde med Håvard. Jeg ville spille, selvfølgelig, men når treneren
                        sier «du har spilt jævlig bra, men du må ut fordi du har fått gult kort» så skjønner jeg det.",Rodt/gult kort
1500,"– Jeg legger kanskje ned noen ekstra meter, vinner noen flere dueller og er bedre i de defensive situasjonene som kan vippe det i vår favør. Det er ikke sånn at jeg har forandret meg som type, men jeg prøver kanskje å ta et gult kort når det er nødvendig og være litt mer «der» da, smiler den – i hvert fall utenfor banen – vennlige 1,93-metersmannen.",Rodt/gult kort
1501,LSK-kapteinen får på grunn av advarselen karantene mot Start etter landslagspausen. Heller ikke Nouri skjønner at han fikk gult kort:,Rodt/gult kort
1502,"– Det var en bra filming. Jeg beskyttet telefonene mine. Det var ikke straffe, men kanskje et gult kort, humrer han. ",Rodt/gult kort
1503,Blaise Matuidi reddet tre poeng for Juve etter en knapp time. Han banket inn vinnermålet fra spiss vinkel etter en nydelig hælflikk fra Mandzukic.,Goal/Assist
1504,18: MÅL! Molde tar ledelsen borte mot Odd! Wolff Eikrem svinger inn en corner som Gabrielsen jakter. Ballen går via Broberg som scorer selvmål.,Ignore
1505,"Fabinho kom fra Monaco i en overgang på rundt 500 millioner kroner, og det var ventet at han ville gå rett inn på den sentrale midtbanen til Jürgen Klopp, spesielt med tanke på at han ikke skulle spille VM for Brasil, og dermed var
                        tilgjengelig i sesongoppkjøringen.",Transfer
1506,"Mariano var del av Real Madrid Castilla-laget som for 3,5 år siden ble kjent for det norske TV-publikummet etter Martin Ødegaards overgang til den spanske gigantklubben.                        Mariano ble imidlertid solgt til Lyon sommeren 2017, før han etter suksess i Ligue 1 nå altså ble hentet tilbake til den spanske hovedstaden for i overkant av 200 millioner kroner.",Transfer
1507,"På kvelden den 27. juni ble Southampton og Basel enige om en overgang for «Moi», som den påfølgende natten forlot klubbens treningsleir for å fly til England. Der stilte han til medisinsk sjekk, som pleier å være en rutinemessig formalitet, men som fikk Elyounoussi til å tvile på om rekordovergangen skulle gjennomføres.",Transfer
1508,"Mellom januar 2015 og sommeren 2016 var nemlig bulgarske Litex Lovetsj arbeidsgiveren til 26-åringen, før han etter tolv mål på 29 ligakamper forsvant videre til Hearts i skotsk toppdivisjon for drøyt to år siden. Underveis i tiden
                        i Skottland kom landslagsdebuten, før rundturen så fortsatte til Nederland, der debutsesongen i ADO Den Haag endte med andreplass på toppscorerlisten og overgang til storklubben AZ Alkmaar.",Transfer
1509,Han ble brukt som en rådgiver da Elyounoussi skjønte at en eventuell overgang til Southampton begynte å nærme seg.,Transfer
1510,"– Det er veldig gøy. Jeg vet at de har hatt lyst til å signere meg i lang tid. De har fulgt meg flere år, og de har snakket med både landslagstrener og agenten min. Vi har snakket om en overgang i flere vindu, så nå gjelder det å svare
                        på den tilliten.",Transfer
1511,"Før det europeiske overgangsvinduet stengte, var dansken blant annet koblet med en overgang til sveitsisk fotball. Mathisen mener slike episoder kan være med på å gjøre det vanskeligere for Bendtner å få en overgang.",Transfer
1512,Cristiano Ronaldo (33) har fått høre det etter 23 skudd uten mål på tre kamper i Juventus-trøye. Roar Stokke advarer derimot mot å avskrive portugiseren allerede nå. ,sjanse
1513,Christian Eriksen har vært en stor suksess i Tottenham siden han ble hentet fra Ajax for fem år siden. På 174 kamper har han scoret 41 mål og levert 49 målgivende.,Player details
1514,"Romelu Lukaku er fortsatt bare 25 år gammel, men belgieren har nådd 104 mål i Premier League for Chelsea, West Bromwich, Everton og Manchester United.",Player details
1515,"For nå har Ronaldo spilt 270 minutter med Serie A-fotball uten nettkjenning. Men det står ikke på forsøkene - portugiseren er den spilleren i topp fem-ligaene med soleklart flest avslutninger uten å score mål (23), ifølge statistikktjenesten Opta. Målgivende har han i det minste, av den mer snodige sorten:",Player details
1516,Reduseringen kom etter 18 minutter. Vivianne Miedema ble spilt fri før hun på lekkert vis rundet keeper Ingrid Hjelmseth og satte ballen i åpent mål. Resten handlet om å forsvare seg for Norges del.,Goal/Assist
1517,"På sine 37 offsideavvinkninger har Lehne Olsen satt ballen i mål tre ganger, og spissen mener selv at han totalt har fått annullert 5–6 scoringer i år.",Goal/Assist
1518,Utover i 2. omgang ble danskene naturlig nok spilt lave. Men slovakene måtte ha hjelp for å få 3–0-målet. Det kom i 81. minutt da en Danmark-forsvarer satte ballen i eget mål. ,Goal/Assist
1519,"Fredrik André Bjørkan fosset frem på venstresiden på det som må være ett av sesongens beste soloraid. 20-åringen kom seg helt ned til dødlinjen og la inn foran mål. Ballen gikk i skulderen på Utvik, så i stangen, før Ulrik Saltnes satte inn returen til 3–1. ",Goal/Assist
1520,"Cardiff fikk kampens første mulighet allerede i åttende spilleminutt da Petr Cech spilte ballen rett i beina på Harry Arter. Den tidligere Bournemouth-spilleren burde satt inn 1-0 for waliserne, men blåste i stedet ballen høyt over
                        mål.",sjanse
1521,"Andreomgang ble mer eller mindre en transportetappe, men Adam Fogt av uheldig og satte ballen i eget mål tolv minutter før full tid. Det endte 3-0.",Goal/Assist
1522,"England jaktet utligning mot slutten av kampen. Seks minutter på overtid satte Danny Welbeck ballen i mål etter en duell med David De Gea, der den spanske keeperen mistet ballen. Men dommeren mente duellen ikke var etter regelboken og annullerte scoringen. De engelske spillerne og England-trener Gareth Southgate ropte ut sin frustrasjon mot avgjørelsen.",Goal/Assist
1523,"Hegerberg, som forrige sesong satte ny mesterligarekord med 15 scoringer på Lyons vei til tittelen, kom til en håndfull sjanser, men fikk ikke ballen i mål.",Player details
1524,"Roberto Firmino satte tidlig ballen i mål, men flagget kom for offside. Firmino var ikke i offside, men foran mål sto Sadio Mane i offside, og flagget kom. En tvilsom avgjørelse. ",sjanse
1525,"Minutter etter utvisningen var Lukaku uhyre nær hat trick. Stjernespissen parkerte Ben Mee fullstendig, og rundet Hart i Burnley-buret. Mee kom seg imidlertid tilbake, og fikk kastet seg inn akkurat da Lukaku skulle trille ballen i
                        mål.",sjanse
1526,"Lionel Messi scoret sitt andre for kvelden da han satte inn Barcelonas sjette mål, før Jordi Alba også tegnet seg på scoringslisten.",Goal/Assist
1527,Haug var selv bare noen centimeter fra å bli målscorer på en heading i 73. minutt. LSK måtte ha hjelp for å få mål. Det fikk de på en corner fra Emilie Haavi som en Zvezda-spiller satte inn i eget mål. ,Goal/Assist
1528,"Norge har kommet et godt stykke under Lars Lagerbäck. De virker tryggere i alle spillets faser, og på hjemmebane ser laget ut til å ha funnet formelen. De er ubeseiret under Lagerbäcks ledelse på Ullevaal stadion. Det er målproduksjonen på bortebane som må opp. Norge har bare scoret fire mål på bortebane, på 21 målsjanser, og kun vunnet to (treningskamper).",Club details
1529," Åpningen var ingen katastrofe for hjemmelaget, som slet med samspillet på det speaker kalte «Norges beste gressbane» - før kampen. FKH rakk ikke å komme inn i det heller, før en forsvarstabbe fra Alexander Stølås gjorde at Gilli Rolantsson plutselig befant seg alene med keeper Bråtveit. Mannen fra Færøyene gjorde ingen feil mot nordmannen, og Brann var i ledelsen med to mål, og det var ikke spilt mer enn 12 minutter med fotball på Haugesund stadion.",Goal/Assist
1530,"’53 - TOTTENHAM TAR LEDELSEN! Lucas Moura slår inn, ballen går i Doucouré - og inn i mål! Hverken Eriksen eller Foster klarer å styre den. Uheldig selvmål - men svakt keeperspill.",Ignore
1531,"Norge fortsatte å dominere i andreomgang, og Bjørn Maars Johnsen burde økt ledelsen etter 55 minutter. AZ Alkmaar-spissen fikk stå helt alene på bakerste stolpe, men stanget ballen like til side for Kypros' mål.",sjanse
1532,"Midtveis i omgangen doblet vertene ledelsen. Xherdan Shaqiri slo et frispark i inn i boksen. Halldórsson slo ballen rett i beina til Fabian Schär, som kunne servere Denis Zakaria på åpent mål til 2-0.",Goal/Assist
1533," Se episoden i videovinduet øverst!
",Ignore
1534," Se sammendrag i videovinduet øverst!
",Ignore
1535," ​Se hele presseseansen med Bendter i videovinduet øverst!

",Ignore
1536," Se hvordan Manchester City beseiret Newcastle 2-1 i videovinduet øverst!
",Ignore
1537," Se hele kampsammendraget i videovinduet øverst. 

",Ignore
1538,"Se hvorfor i videovinduet øverst!
",Ignore
1539," ​Se Rashfords scoring for England i videovinduet øverst!

",Transfer
1540,Se tabben i videovinduet øverst i saken.,Ignore
1541,Se analysen i videovinduet øverst.,Ignore
1542,Se sammendrag fra kampen i videovinduet øverst på siden!,Ignore
1543," Se resultatet i videovinduet øverst!

",Ignore
1544,"Det sto målløst til pause, men allerede fem minutter inn i andreomgang løsnet det for Juventus og Ronaldo. Et hjørnespark ble headet i egen stolpe av Gianmarco Ferrari, returen endte opp på åpent mål og Ronaldo trillet enkelt inn 1-0
                        for Juventus.",Goal/Assist
1545,"Maanum spilte på topp sammen med Line Hurtig og serverte makkeren 2-0-målet i det 48. minutt, da hun alene med keeper uegoistisk dyttet ballen til side slik at dansken hadde åpent mål. Selv gjorde Maanum 1-0 i det 26. minutt (med et
                        velplassert skudd rundt keeper fra 16 meter) og 3-0 i det 60. minutt (da hun pirket inn en keeperretur). Etter at Marie-Yasmine Alidou kom inn for Hurtig fikk hun også en målgivende pasning fra Maanum.",Goal/Assist
1546,Chelsea malte ned nok en motstander og tar landslagspause med full pott på fire kamper. Blåtrøyene har scoret mål etter 80 minutter i hver kamp så langt og avgjorde sin tredje kamp på rad i de siste 20 minuttene.,Club details
1547,"Frankrike hadde de største sjansene i de første 45. Olivier Giroud, som ikke scoret et eneste mål i sommerens VM, var nærmest med sitt forsøk i det 36. minutt. Spissen fikk nok en sjanse som han brant ett minutt på overtid. ",sjanse
1548,"Hun har scoret jevnt og trutt for Lyon, som i mai vant Champions League for tredje år på rad, og den tidligere Kolbotn- og Stabæk-spilleren har totalt 38 mål på sine 66 kamper for Norge. ",Player details
1549,"41-åringen spilte én sesong i Barcelona fra 1996 til 1997. Da scoret han 47 mål på 49 kamper. Han spilte så i Milan i fem år før han i 2002 vendte tilbake til Spania, den gang til Real Madrid.",Player details
1550,"Spitse har scoret fem mål for Nederland i kvalifiseringen. Det er fire flere enn Herlovsen. Mot Slovakia på fredag hadde «Isa» flere muligheter til å pynte på en statistikk i VM-kvaliken som en spiss ikke er så stolt av, men hun fikk ikke ballen i mål.",sjanse
1551,"Siden har han spilt 283 kamper for Liverpool, og scoret 24 mål. Han tok over kapteinsbindet da Steven Gerrard forlot klubben i forkant av 2015/16-sesongen.",Player details
1552,"Stefan Johansen scoret Norges to mål i seieren over Kypros, men det var flere som kunne tegnet seg på måltavlen med litt mer hell. Blant dem var stjernespiss Joshua King som i første omgang mener han ble felt og burde hatt straffe.",Goal/Assist
1553,Han gikk 11. august videre til Eskilstuna på nivå 2 og scoret sist helg sitt første mål – mot Norrby.,Goal/Assist
1554,"Edinson Cavani (a) stortrives mot nettopp Saint-Etienne ettersom han har laget 11 mål i karrieren mot nettopp Les Vertes. Kun mot Monaco har han høyere målkvote i fransk fotball. Mot monegaskerne har han scoret 12 ganger, ifølge PSGs hjemmesider. Gjestene har bokført 1-3-0-åpningsflyt i Ligue 1, men har ikke scoret på 182 minutters spill. ",Player details
1555,Lukaku har scoret tre mål i Premier League denne sesongen. Bare Liverpool-ving Sadio Mané og Fulham-spiss Aleksandar Mitrovic har scoret flere mål enn Lukaku i sesonginnledningen med fire fulltreffere hver.​​,Player details
1556,I 2017/18 brukte Ronaldo 28 skudd før det første ligamålet kom. Deretter scoret han 26 mål de neste 27 kampene. Portugiseren har blitt toppscorer i Champions League de siste seks årene. ,Player details
1557,"Mot Island i juni ble King plassert på benken fra start, men kom inn og scoret. Få dager senere sto han for kampens eneste mål da Panama ble beseiret.",Goal/Assist
1558,"Reprisene viste at ballen var inne før målvakten slo den unna. Dermed sto det 1-0 til Liverpool, og Wijnaldum hadde scoret sitt første mål på bortebane i Premier League.",Goal/Assist
1559,"Spilte hele kampen, scoret 1-0-målet og leverte et mål da det ble 5-0 hjemme over Giannina. Har spilt begge kampene for de greske serielederne.",Goal/Assist
1560,"Men hvor lenge var Sarpsborg i himmelen? Knapt fem minutter. Da fikk Odd frispark rett utenfor 16-meteren. Espen Ruud og nesten hele resten av Odd-laget gjorde seg klar. Backen bøyde ballen over muren og opp i hjørnet. Der sto Amin Askar, men han nådde ikke opp til å stoppe ballen. 1–2 på Sarpsborg stadion! Det var Ruuds sjette mål for sesongen.",Goal/Assist
1561,"Ranheim så ut til å gå mot sin første seier på det nylagte kunstgresset, men så - nesten tre minutter på overtid - fikk banens beste spiller sin fjerde store sjanse i kampen.",sjanse
1562,Det til tross for at han innerst inne vet at det blir svært vanskelig for Sandefjord å berge plassen i Eliteserien i år.  Åtte kamper før slutt har Sandefjord sju poeng opp til Start på kvalifiseringsplass.,Club details
1563,"Om lag 1500 tilreisende fra Bergen fikk se storkjøpet Daouda Bamba score sitt første mål i Brann-drakt etter overgangen verdt åtte-ni millioner kroner fra Kristiansund. Det var også hans
                        første kamp fra start for Brann.",Goal/Assist
1564,"Nederland hadde ikke sluppet inn mål på 630 minutter. Det norske laget hadde forberedt seg på å jage et seiersmål, men før det var spilt seks minutter hadde ferske Ingrid Syrstad Engen og veteranen Herlovsen kriget inn hver sin scoring.",Goal/Assist
1565,"Stefan Johansen tok utfordringen ved at noen stilte spørsmålet ved hans plass på laget, ved å spille en veldig god kamp og score to mål.",Goal/Assist
1566,Fikk starte for første gang på ett år – brukte elleve minutter på å score,Goal/Assist
1567,Isabell Herlovsens scoring i sjette spilleminutt ble til slutt avgjørende.,Goal/Assist
1568," Se King i klammeri med Morata øverst!
",Ignore
1569,Se scoringen i videoen øverst.,Ignore
1570," Se hvordan Sarpsborg kvalifiserte seg til Europaligaen i Sportsnyhetene øverst!
",Ignore
1571," ​Se TV 2s reportasje om Odds miljøprosjekt øverst!

",Ignore
1572,"Se høydepunktene fra kampen i vinduet øverst!
",Ignore
1573,På videoen øverst i saken kan man tydelig se hvordan en oppgitt Yedlin spør dommer Fernando Guerrero: «Did you watch the World Cup?»,Ignore
1574,"Se Krajevs suser som sørget for åpningsmålet mot Slovenia i vinduet øverst!
",Ignore
1575,Se hva Jesper Mathisen tror om søndagens kamp mot Bulgaria i vinduet øverst.,Ignore
1576,"Se den fantastiske scoringen i vinduet øverst!
",Ignore
1577,Se Nations League på TV 2 Sumo og TV 2 Sport Premium!,Ignore
1578,Se Norge mot Kypros på TV 2 og Sumo torsdag fra kl. 20. Kampstart kl. 20.45.,Ignore
1579,"Se Nations League på TV 2 Sumo og TV 2s kanaler!
",Ignore
1580,Se Tottenham - Liverpool på TV 2 Sport Premium og TV 2 Sumo lørdag fra klokken 12.45,Ignore
1581,Se Tottenham mot Liverpool på TV 2 Sport Premium og Sumo fra kl. 12.45.,Ignore
1582,"Se Premier League på TV 2 Premium og TV 2 Sumo lørdag fra kl. 13.00

",Ignore
1583,Se Norge-Kypros på TV 2 og tv2sumo.no torsdag fra kl. 20.00.,Ignore
1584,Se Slovakia mot Danmark på TV 2 Sport Premium og Sumo onsdag klokken 20.45.,Ignore
1585,Se Norge mot Kypros på TV 2 og Sumo torsdag fra kl. 20. Kampstart kl. 20.45.,Ignore
1586,Se Norge-Kypros på TV 2 og tv2sumo.no torsdag fra kl. 20.00.,Ignore
1587,Se Slovakia-Danmark på TV 2 Sport Premium og TV 2 Sumo onsdag klokken 20.45.,Ignore
1588,Se Bulgaria-Norge på TV 2 eller Sumo fra klokken 17.30! ​,Ignore
1589,Se Bulgaria-Norge på TV 2 og tv2sumo.no søndag kl. 18.,Ignore
1590,Se Rekdal knekke sammen av Hulsker her:,Ignore
1591,Se Norge-Kypros på TV 2 og tv2sumo.no fra kl. 20.00 torsdag.,Ignore
1592,Nations League-forvirring på landslaget - se video her:,Ignore
1593,"Begge lag scorer (1,45) eller scoringsspill på Harry Kane anser vi for å være gode spill, men i selve kampen går vi for uavgjort til 3,30 i odds. Spillestopp er 13.25, og kampen kan du se på TV 2 Sport Premium. ",Ignore
1594,Her er kulturministeren på stadion. Se hun juble for Vålerenga-mål:,Ignore
1595,"Lørdag ser du en rekke Nations League-kamper på TV 2s kanaler og TV 2 Sumo, deriblant England-Spania. Se hele oversikten her!",Ignore
1596,Det «stikkes» fra Trøndelag i retning hovedstaden – se video:,Ignore
1597,Se Nations League på TV 2s kanaler.,Ignore
1598,På torsdag er Maars Johnsen aktuell for det norske landslaget som møter Kypros. Se kampen på TV 2 og tv2sumo.no fra kl. 20.00.,Ignore
1599,Nations League fra klokken 20.35: Se Tyskland-Frankrike på TV 2 Sport Premium eller Sumo! ​,Ignore
1600, Se Norge-Kypros på TV 2 og tv2sumo.no torsdag fra kl. 20.00. ,Ignore
1601,Se situasjonen som fikk Brann-spillerne til å rope etter VAR på trening:,Ignore
1602,Liverpool skal tirsdag ut mot Paris Saint-Germain i den TV 2 Sport 1- og Sumo-endte Champions League-åpningen på Anfield. Liverpool Echo skriver allerede at Firmino er usikker til storkampen.,Ignore
1603,Lynvingen er etter alt å dømme med i startoppstillingen når et tabelltoppjagende Spurs gjester Watford i ettermiddag. Kampen ser du på TV 2 Sport Premium eller Sumo klokken 17.00!,Ignore
1604,TV 2 har rettighetene til å vise hele Nations League. Det vil si at alle Norges kamper kommer til å gå på hovedkanalen TV 2 samt TV 2 Sumo.,Ignore
1605,"Men med Berge og Henriksen i tospann på den sentrale midtbanen har Norge ennå ikke avgitt poeng. Om seiersrekken fortsetter, ser du på TV 2 eller Sumo fra klokken 17.30. ",Ignore
1606,"For selv om banens beste spiller, Mohamed Fellah, berget ett poeng for Sandefjord med sin scoring etter 69 minutter, ser tabellsituasjonen bekmørk ut for hvalfangernes del.",Goal/Assist
1607,"England ble kjørt over av Sveits i første omgang, men etter pause sørget Marcus Rashford for 1-0-seier i tirsdagens treningskamp. Rashfords scoring sikret England seieren etter tre strake tap.",Goal/Assist
1608,"Arsenal tok sin tredje strake ligaseier, og matchvinner ble Mesut Özil. Tyskeren scoret 2–0 etter 58 minutter, etter at Granit Xhaka hadde satt inn et frispark ni minutter tidligere. Newcastle reduserte på overtid, men står fortsatt bare med ett poeng så langt i sesongen.",Goal/Assist
1609,"I annen omgang scoret Richarlison sitt andre og Brasils fjerde, før Marquinhos satte punktum med sin 5-0 scoring i kampens siste minutt.",Goal/Assist
1610,"– Å score helt på slutten da var en fantastisk lettelse. Det var ikke det peneste målet mitt, men ett av de viktigste. ",Goal/Assist
1611,"Mer feil kunne man ikke tatt. To minutter senere slo Tyrkia tilbake ved Hakan Çalhanoglu. AC Milan-spilleren skjøt forbi Mikael Lustig og inn ved lengste stolpe, og plutselig var gjestene tilbake i oppgjøret med sin 1–2-scoring. ",Goal/Assist
1612,"Ved Pulidos selvmål og ved Suárez’ scoring ble VAR tatt i bruk, og begge gangene bidro videodømmingen til at riktige avgjørelser ble tatt. Den regjerende seriemesteren opprettholder dermed sin perfekte start på sesongen, og står nå med tre strake seiere etter tre kamper. ",Goal/Assist
1613,"Like etter kunne «Moi» virkelig ha blitt den store helten. Han hev seg frem på en retur fra Hennessey, men avslutningen var millimetere unna 24-åringens første scoring i Premier League og gikk rett i tverrliggeren.",sjanse
1614,Den ledelsen ble til 5-0 drøyt ti minutter senere da Asensio prikket en corner på hodet til Serigo Ramos. Real Madrid- og Spania-lagkameraten stanget kontant inn kampens femte scoring.,Goal/Assist
1615,"«Det burde vært en rutinemessig redning, men i stedet flyr ballen inn i nettet», skriver Birmingham Mail om det sistnevnte målet. Men forrige helg fikk han også ros for disse redningene:",Goal/Assist
1616,"Det første magiske Asensio-øyeblikket fikk hjemmepublikumet etter drøyt 30 minutter da 22-åringen snappet opp en feilpasning som han nærmest stillestående banket i nettet fra drøyt 20 meter. Så viste Asensio igjen klasse da han to
                        minutter senere dro seg inn i banen, hamret ballen i tverrliggeren og tilbake inn i målet via en sjanseløs Lovre Kalinic mellom stengene.",Goal/Assist
1617,Stefan Johansen var for slapp i presset mot Bernardo Silva som vendte opp og spilte inn til Sergio Agüero. Agüeros skudd ble blokkert men havnet hos David Silva som satte ballen i nettet.,Goal/Assist
1618,"Etter 13 minutter ble det likevel scoring i St. Gallen. Granit Xhaka slo på tvers utenfor Islands sekstenmeter, der kom venstreback Ricardo Rodriguez og spilte tilbake til Steven Zuber. Vingen klinket til og sendte ballen rett inn
                        i det lengste hjørnet via tverrliggeren.",Goal/Assist
1619,England spilte for øvrig treningskamp hjemme mot Sveits og slo tilbake fra fredagens 2–1-tap hjemme for Spania i Nations League-debuten. Marcus Rashford fikk en lett oppgave med å styre inn Kyle Walkers innlegg i det som ble kampens eneste scoring på King Power Stadium.,Goal/Assist
1620,"Johansen var enda nærmere sin tredje Nations League-scoring drøyt ti minutter før pause. Mohamed Eloyounoussi leverte et strålende forarbeid før han fant Johansen bak i feltet. Landslagskapteinen avsluttet på direkten, men ballen lurte
                        seg utenfor stolpen og i nettveggen.",sjanse
