,text,label
4524,"Tre dager før overgangsvinduet lukkes ble den spanske landslagsspissen hentet fra Barcelona, i første omgang på en sesonglang leieavtale. Borussia Dortmund har sikret seg opsjon på kjøp dersom leieoppholdet svarer til forventningene.",Transfer
4525,Real Madrid bekrefter at de har hentet spissen Mariano Díaz tilbake til klubben.,Transfer
4526,"Wolves er tilbake på øverste nivå i England etter seks års fravær. Ulvene var helt overlegne i Championship forrige sesong, og i forkant av denne sesongen, har de hentet inn den ene superstjernen etter den andre. ",Club details
4527,"I sommer har Liverpool og Atlético Madrid forsynt seg fra Monaco med henholdsvis Fabinho og Thomas Lemar. Barcelona har hentet Malcom fra Bordeaux, Fulham har brukt 60 millioner pund på Frank Zambo Anguissa fra Marseille og Jean Michaël Seri fra Nice, mens West Ham har åpnet lommebokken for stoppertalentet Issa Diop fra Toulouse.",Transfer
4528,Etter salget av Ronaldo har den ferske Real Madrid-treneren Julen Lopetegui kun hentet den unge backen Álvaro Odriozola som eneste utespiller. I mellomtiden har Marco Asensio (22) har blitt utpekt som Ronaldo arvtager på venstrekant. ,Transfer
4529,"Håpet ble tenkt for Zenit da Leandro Paredes ordnet 1-0 etter 22 minutters spill, men ikke før etter 66 minutter kom scoring nummer to ved Christian Noboa.",Goal/Assist
4530,"På overtid i ekstraomgangene scoret så Róbert Mak to Zenit-mål til, og dermed ble det 8-1-seier til russerne.",Goal/Assist
4531,"Det betyt at klubben har hentet intet mindre enn tre spillere fra Barcelona denne sommeren. Everton betaler omlag 20 millioner kroner for å låne spilleren, i tillegg til spillerens lønn.",Transfer
4532,"Østerrikeren Samuel Sahin-Radlinger (25) har stått alle Branns kamper denne sesongen. Han er på lån fra tyske Hannover frem til sesongslutt, men Brann har en opsjon på å kjøpe ham på permanent basis. Spørsmålet er om dette fortsatt er aktuelt etter at bergenserne hentet den gamle kjenningen Håkon Opdal (36) fra Start på tampen av overgangsvinduet. Opdal spiller ut sesongen i Start før han blir Brann-spiller på nyåret.",Transfer
4533,Fra før har Burnley hentet midtstopper Ben Gibson fra Middlesbrough og tidligere England-målvakt Joe Hart fra Manchester City denne sommeren. Klubben imponerte voldsomt da de kom på sjuendeplass i fjorårets Premier League.,Transfer
4534,"Mesfin har vært på jobb i sommerferien og hentet både den sentrale midtbanespilleren Daniel A. Pedersen fra AGF Aarhus som en gratisovergang, pluss fått Arnor Smarason fra Hammarby (offensiv midtbane/angrep). Sånn sett har Lillestrøm posisjonert seg for en Mathew-overgang denne høsten, der kanarifuglene spiller for fornyet Eliteseriekontrakt og ny cupfinale. ",Transfer
4535,"Til Sarpsborg kommer målmannen fra finske Lahti. Etter som han var «free agent», som han selv uttrykker det, er han nok en god spiller som Sarpsborg har hentet uten å trekke gullkortet.",Transfer
4536,"Everton har i tillegg hentet Lucas Digne, Richarlison, Yerry Mina, André Gomes og Bernard i sommer. De tre sistnevnte sikret Merseyside-klubben seg på Deadline Day.",Transfer
4537,Torsdag ble det også kjent at Start også har hentet ghanesiske Ibrahim Mensah fra den slovakiske klubben NK Aluminij.,Transfer
4538,"I tur og orden har Fulham bekreftet lånesigneringene av Sergio Rico fra Sevilla, Luciano Vietto fra Atlético Madrid og Timothy Fosu-Mensah fra Manchester United. Samtlige er hentet inn for én sesong.",Transfer
4539,"I tillegg til å ha hentet nevnte Leno og Lichtsteiner, har også Sokratis Papasthathopoulos blitt signert av den nye treneren Unai Emery. Spillestilen til grekeren passer Premier League perfekt, forteller Ween.",Transfer
4540,Start har også hentet Herolind Shala denne sommeren. ,Transfer
4541,Til tross for Rafael Benítez og Newcastles trange budsjett har de hentet inn noen rimelige spillere og noen på lån.,Transfer
4542,"Traoré blir nyopprykkede Wolverhamptons femte signering i sommer. Fra før av har de hentet Rui Patrício, Jonathan Castro Otto, João Moutinho og Raúl Jiménez.",Transfer
4543,"Tidligere i sommervinduet har Brann også hentet Ruben Yttergård Jenssen. Sivert Heltne Nilsen og Jonas Grønner har forlatt bergenserne i sommer. Tirsdag ble både Thomas Grøgaard og Håkon Opdal signert. Sistnevnte slutter seg ikke til
                        Brann før nyttår. Det samme gjelder for Ranheim-profilen Kristoffer Løkberg.",Transfer
4544,"Rico, som står med én landskamp for Spania, lånes bort fra Sevilla etter den spanske storklubben hentet Basel-keeper Tomás Vaclik. De siste sesongene har 24-åringen vært fast inventar på laget.",Transfer
4545,"25-åringen, som har sju landskamper for Spania, ble hentet fra Bayern München og har fått en treårskontrakt. Overgangssummen er ikke offentliggjort.",Transfer
4546,"Klubben har allerede hentet inn én spiller; tunisiske Issam Jebali (27). Tunisieren er ikke spilleklar enda, men så kampen fra tribuneplass.",Transfer
4547,"Han får støtte av lagkamerat og sin gode venn Fredrik Midtsjø, som også ble hentet fra Rosenborg til Alkmaar. Midtsjø selv er ikke i tvil om at han har tatt store steg i løpet av tiden i nederlandsk fotball.",Transfer
4548,"Mourinho, som nå virker truet i klubben, har hentet inn den 19 år gamle høyrebacken Diogo Dalot fra Porto før sesongen. I fjor kom Victor Lindelöf inn for over 300 millioner, mens året før kom Eric Bailly inn for en enda større sum. ",Transfer
4549,"Etter et sesonglangt utlån til Sheffield United, dro Coady til Huddersfield på permanent overgang sommeren 2014. Ett år senere ble han hentet til Wolves, der han har utviklet seg til å bli en stor suksess.",Transfer
4550,"Manchester United har i tillegg «bare» hentet Fred, Diogo Dalot og Lee Grant under overgangsvinduet som stenger 9. august, og Mourinho sier at han vil ha inn to nye spillere. ",Transfer
4551,"Siden han ble hentet fra Levante i 2014, har Keylor Navas voktet buret på Santiago Bernabeu. Costaricaneren har ingen planer om å dra ennå, og varsler at han kommer til å gi Courtois kamp om å bli Julen Lopeteguis førstevalg.",Transfer
4552,"​Ifølge Transfermarkt har Cardiff brukt under 300 millioner kroner for å styrke laget, til tross for at de har hentet seks spillere. Warnock har vært ærlig på at han ikke er den beste manageren til å finne gull på overgangsmarkedet.",Transfer
4553,"Fulham har nemlig vist en imponerende evne til å tiltrekke seg attraktive spillere: Jean Michaël Seri er hentet fra Nice selv om Barcelona, Chelsea og Arsenal var på hugget, mens 2014-verdensmesteren André Schürrle kommer fra Dortmund. Hvis spissen Aleksandar Mitrovic, som var god i VM og har signert en langtidskontrakt, kan levere lignende målform som på våren (12 mål på 17 kamper), bør ikke nedrykk være noen stor bekymring.",Transfer
4554,John Kitolano (18) har skrevet under for Wolverhampton.,Transfer
4555,Midtbanetalentet Johan Hove har skrevet under for Godset.,Transfer
4556,"Overgangssagaen er omsider over. Erling Braut Haaland (18) bytter ut Molde med RB Salzburg, men ikke før 1. januar. Spisskometen har skrevet under på en femårskontrakt med klubben.",Transfer
4557,DRAMMEN (VG) (Strømsgodset - Start 1–1) Start-keeper Jonas Deumeland ble fraktet med ambulanse til sykehus i Drammen etter et sammenstøt med en lagkamerat. Søndag kveld ble han skrevet ut.,Injuries
4558,Kepa Arrizabalaga (23) har skrevet under på en sjuårskontrakt med Chelsea.,Transfer
4559,Horn har skrevet under på en avtale som strekker seg tre og et halvt år frem i tid.,Transfer
4560,"Den tidligere Vålerenga-profilen har vært klubbløs siden 1. juli, og 29-åringen har trent med Eliteserie-klubben de siste dagene. Nå har han skrevet under på en kontrakt seg som strekker seg over ett år.",Transfer
4561,"36-åringen returnerer til Bergen fra og med kommende sesong, og har skrevet under på en toårskontrakt. Det bekrefter Brann på sine nettsider.",Transfer
4562,"Heltne Nilsen har skrevet under en femårskontrakt med den danske klubben, som ligger på 9. plass i Superligaen etter tre spilte runder.",Transfer
4563,"Bernard kommer gratis til Everton, og har skrevet under på en fireårskontrakt med Merseyside-klubben.​",Transfer
4564,"Courtois har skrevet under på en seksårsavtale med de regjerende Champions League-mesterne, og skal bli signert torsdag 13.00 på Santiago Bernabeu, etter den medisinske testen. Han forlater dermed Chelsea etter syv år,  to Premier League-titler, samt en FA Cup-tittel og en ligacuptittel. ",Transfer
4565,"Horn har skrevet under på en avtale ut 2021,  er spilleklar umiddelbart og blir samtidig en naturlig arvtager for midtstopper Joackim Jørgensen på sikt, som fra og med sesongen 2019 skal spille for Start.",Transfer
4566,Jebali har skrevet under en fireårskontrakt med trønderne.,Transfer
4567,"Midtbanespilleren som alltid er på løp, headet inn 1–0 etter 72 minutter. En scoring som var som skrevet i trener Geir Bakkes manus: Langt innkast, stuss, og avslutning i neste duell. Joachim Thomassen kastet, Joackim Jørgensen headet videre og Zachariassen satte skallen på ballen.  ",Goal/Assist
4568,Rett før overgangsvinduet stengte sikret storklubben seg en ny spiss.,Transfer
4569,"Manchester United har sikret seg tre nysigneringer, Fred fra Shaktar Donetsk,  Diogo Dalot fra Porto og Lee Grant fra Stoke. José Mourinho har gitt tydelig uttrykk for at han ønsker seg to spillere til. ",Transfer
4570,"Et kunstmål av Issam Jebali, en kraftheading av Nicklas Bendtner og en såkalt «tap in» av Jonathan Levi sørget for at Rosenborg vant komfortabelt 3-1 og sikret seg et solid utgangspunkt foran returkampen i Makedonia neste uke.",Goal/Assist
4571,Tidligere i sommer har Start sikret seg Herolind Shala ut sesongen. I tillegg er det klart at Joackim Jørgensen (29) blir Start-spiller fra 1. januar. Han kommer som bosmanspiller fra Sarpsborg 08.,Transfer
4572,"Denne sesongen skal Champions League også sendes på TV 2s kanaler. TV 2 har sikret seg rettighetene til å sende én kamp hver kampdag, inkludert finalerundene. Selve finalen samsendes mellom TV 2 og MTG.",Ignore
4573,Dermed har Tottenham sikret seg et godt utgangspunkt med seks poeng etter sesongens to første kamper.,Club details
4574,Slik sikret Liverpool seg seieren sist helg – da Alisson imponerte mer:,Ignore
4575,"Denne sesongen skal Champions League også sendes på TV 2s kanaler. TV 2 har sikret seg rettighetene til å sende én kamp hver kampdag, inkludert finalerundene. Selve finalen samsendes mellom
                        TV 2 og MTG.",Ignore
4576,"I en rekke intervjuer den siste tiden har den franske VM-helten benyttet anledningen til å dyrke overgangsryktene som har svirret rundt ham siden i sommer, da han ifølge flere medier skal ha ønsket å bli solgt til Barcelona.",Transfer
4577,Liverpool har solgt den estlandske midtstopperen Ragnar Klavan (32) til Serie A-klubben Cagliari.,Transfer
4578,De to nederlandske klubbene ble mandag enige om overgangssummen. Dermed gjenstår forhandlingene om Maars Johnsens personlige kontrakt med AZ Alkmaar samt den obligatoriske medisinske sjekken.,Transfer
4579,"Celtic-manager Brendan Rodgers har flere ganger sagt at Dembélé ikke ville bli solgt i dette overgangsvinduet, men ryktene om den forestående overgangen begynte å svirre da spissen uteble fra trening dagen før torsdagens europaligakvalifisering.",Transfer
4580,Den sveitsiske avisen skriver at Zurich er på spissjakt etter å ha solgt Raphael Dwamena til Levante og Michi Frey til Fenerbahce. Igjen har klubben nemlig bare én spiss: Stephen Odey. ,Transfer
4581,"Trønderen ble solgt fra FC Midtjylland til Crystal Palace for hundre millioner kroner (pluss fremtidige bonuser) i januar, og han fikk nummer ni på ryggen – et tall han har beholdt denne sesongen.",Transfer
4582,"Alisson (67 mill. pund), Naby Keita (48 mill. pund), Fabinho (44 mill. pund) og Xherdan Shaqiri (13 mill. pund) skal prøve å skyte Liverpool til deres første Premier League-tittel på 28 år, mens Fred er den ene store signeringen United gjorde i sommer. Brasilianeren kostet Manchester-klubben 52 millioner pund. Richarlison har blitt solgt til Everton fra Watford for ekstreme 40 millioner pund, mens Lucas Digne har kommet fra Barcelona for «bare» 18 millioner pund.",Transfer
4583,"Men mye har skjedd siden forrige serierunde: Rosenborg har ny, midlertidig trener, Molde har henter hjem Magnus Wolff Eikrem og Brann solgte mandag ettermiddag en av sine største profiler.",Transfer
4584,"Yaya Touré har hatt en eventyrlig karriere i europeisk fotball. I 2006 gikk han til Monaco, før Barcelona kom på banen året etter. Det ble tre sesonger, to La Liga-titler og én Mesterliga-triumf på Camp Nou. Da ble han solgt til hardtsatsende
                        Manchester City, hvor han vant Premier League tre ganger.",Player details
4585,"Svenssons lagkamerat og gode venn Fredrik Midtsjø hadde en kanonsesong i AZ i fjor og kjenner - i likhet med Svensson (solgt til AZ januar 2017) - ligaen godt etter overgangen fra Rosenborg for ett år siden. Han er overbevist om at
                        Ødegaard har kommet til riktig klubb.",Transfer
4586,"Kastrati er ikke den første spissen som kommer til klubben i sommer: KBK har også signert Simon Alexandersson (25) fra svenske Brage, ettersom de solgte Benjamin Stokke til danske Randers tidligere i overgangsvinduet.",Transfer
4587,"Det er nemlig ikke bare på banen at Molde leverer resultater denne sommeren: Videresalget av Mohamed «Moi» Elyounoussi førte, slik VG tidligere har omtalt, til inntekter på rundt 30 millioner kroner. I tillegg ble stortalentet Leo Skiri Østigård solgt til Premier League-klubben Brighton for en ukjent sum og utvilsomt med en betydelig videresalgsklausul. Nå er MFK i ferd med å håve inn enda mer: Det nært forestående salget av Erling Braut Håland til RB Salzburg skal ifølge Eurosport ha en mulig totalramme på 100 millioner kroner.",Transfer
4588,"Sivert Heltne Nilsen (26) briljerte i denne posisjonen med sin lederevne, krigerske innstilling og defensive kvaliteter. Han ble i sommer solgt til danske AC Horsens. Kristoffer Barmen (24) har vikariert etter overgangen, men i utgangspunktet ser den tidligere landslagsspilleren Ruben Yttergård Jenssen (30), ny fra FC Groningen, ut som Heltne Nilsens erstatter.",Transfer
4589,"Flere har reagert etter at Brann solgte Sivert Heltne Nilsen til Horsens midt i sesongen, og før kampen åpnet trener og pappa Lars Arne Nilsen litt mer opp om situasjonen. ",Transfer
4590,"Overgangsvinduet for norske klubber stenger natt til torsdag, så et skadeplaget Rosenborg har dårlig tid på seg for å sikre seg de ønskede forsterkningene. Mandag sikret de seg signaturen til serbiske Djordje Denic.",Transfer
4591,"Tottenham er det eneste laget i Premier League som ikke signerte en eneste ny spiller i sommerens overgangsvindu. De har derimot sikret seg Harry Kane i seks nye år. Kane, som bøttet inn mål for England og ble toppscorer i VM, skrev
                        under kontrakten like før mesterskapet i Russland. Også Heung-min Son har i sommer skrevet under en ny kontrakt som går over tre år.",Transfer
4592,"To av Hålands lagkamerater på det norske U19-VM-laget har det siste døgnet sikret seg overganger til større klubber: Leo Skiri Østigård har gått fra Molde til Brighton, mens Odd-kometen John Kitolano torsdag ble klar for Wolverhampton.",Transfer
4593,Tromsø har benyttet seg av sin opsjon på kjøp av Robert Taylor. Midtbanespilleren har signert en kontrakt med eliteserieklubben som løper ut 2021.,Transfer
4594,Ruben Yttergård Jenssen (30) er tilbake i norsk fotball og har signert en kontrakt som strekker seg ut 2020 med gulljagende Brann.,Transfer
4595,Erling Braut Håland (18) er i Salzburg for å signere kontrakt med Red Bull Salzburg.,Transfer
4596,"23-åringen, som nylig signerte ny kontrakt med Arsenal, lånes ut sesongen til Stefan Johansens klubb Fulham.",Transfer
4597,"Den britiske avisen Telegraph hevder at Chelsea har utløst utkjøpsklausulen i den
                        23 år gamle keeperens kontrakt, som skal ligge på 753 millioner kroner.",Transfer
4598,"17-åringen forlater Sogndal til fordel for Godset, og tirsdag reiser han til Drammen for å gjennomføre medisinsk test og signere en kontrakt som strekker seg ut 2021-sesongen. Det skriver Godset på sine nettsider.",Transfer
4599,"Ryktene ville ha det til at Zaha var uvillig til å signere en ny kontrakt med Sør-London-klubben, og med det internasjonale overgangsvinduet fremdeles åpent, var det fortsatt en del Palace-fans som bet negler angående fremtiden til
                        sin stjerne.",Transfer
4600,"Klubbene har blitt enige om å ikke offentliggjøre overgangssummen, men Birmingham Mail skriver at prislappen er på drøye ti millioner kroner. Den engelske nivå to-klubben skriver at landslagskeeperen har signert en tre år lang kontrakt med Birmingham-klubben. ",Transfer
4601,En kontrakt på tre millioner kroner i uken skal være nok til å overbevise Hazard om å bli. ,Transfer
4602,"Maguire er ikke den eneste spilleren som kobles til United. L'Equipe skriver i dag at PSG-back Layvin Kurzawa jaktes
                        på av rødtrøyene. Også Tottenham og Wolves har vist interesse for franskmannen med kontrakt til 2020.",Transfer
4603,"Ødegaard skal ha en kontrakt med Real Madrid som løper til 2021, men det er ikke bekreftet. Han blir 20 år i desember.",Transfer
4604,"Denic har fått draktnummer fem, og har signert en kontrakt med Rosenborg med en varighet på tre og et halvt år, skriver rbk.no.",Transfer
4605,"Hugo Lloris skrev i sommer ny kontrakt med Tottenham til ei ukelønn på 1,6 mill. kroner. Han er ifølge Telegraph sjelden å se utenfor fotballbanen. Han lever et rolig familieliv med ungdomskjæresten Marine. ",Transfer
4606,"Real Madrids løsning på Modric-situasjonen skal være å tilby en forbedret kontrakt, som løfte ham opp til Sergio Ramos’ lønnsnivå.",Transfer
4607,"Solskjær var ifølge Romsdals Budstikke interessert i å hente midtbanespilleren allerede i vinter, før han gikk til Seattle Sounders. Eikrem trente da med Molde, og ble tilbudt kontrakt, men satte seg da isteden på flyet til USA.",Transfer
4608,"Malcom skulle i utgangspunktet sette seg på flyet fra Bordeaux til Roma for å gjennomføre den medisinske undersøkelsen og skrive under på en kontrakt med klubben, men endte isteden opp på et fly til Barcelona. ",Transfer
4609,"18-åringen er midtstopper og under kontrakt med Molde, men har vært på utlån til Obosliga-klubben Viking denne sesongen.",Transfer
4610,Mateo Kovacic har kontrakt med Real Madrid ut 2020/21-sesongen.,Transfer
4611,Martin Ødegaards kontrakt med Real Madrid skal løpe fram til 2021. Den spanske storavisen Marca skrev tidligere i august at hovedstadsklubbens nye trener Julen Lopetegui liker Ødegaard og skal være villig til å gi ham tid til å blomstre.,Transfer
4612,"Det er mer enn de betalte for Ruben Néves, og dermed ny overgangsrekord for klubben.",Transfer
4613,"Så mye ville det neppe blitt om Vålerenga skulle fiske til seg 24-åringen fra Holmlia, selv om det trolig hadde vært en betydelig pengebruk i norsk sammenheng. Vålerenga har lent seg på økonomisk støtte fra investor Tor Olav Trøim gjennom flere år, men Stabæk-trener Henning Berg tviler på at det finnes nok midler på Valle til å hente Stabæk-spissen med kontrakt ut 2020-sesongen.",Transfer
4614,"Den gode nyheten for Tottenham-fansen er selvsagt den at ingen av lagets stjerner har forlatt klubben. Mauricio Pochettino og Harry Kane signerte nye kontrakter i vår, og dementerte dermed effektivt alle potensielle overgangsrykter.
                        De to belgierene Toby Alderweireld og Moussa Dembélé var to spillerne som lenge virket å være på vei bort, men enn så lenge er begge Spurs-spillere.",Transfer
4615,Chelsea er enige med Real Madrid om en overgangssum for Thibaut Courtois. Mateo Kovacic går motsatt vei på et sesonglangt lån.,Transfer
4616,Brynes daglige leder vil ikke kommentere hvor stor andel av en potensiell overgangssum klubben har krav på. Årsaken er at klubbene har blitt enige om å holde innholdet i kontrakten hemmelig. Men VG har grunn til å tro at den er på 15 til 20 prosent.,Transfer
4617,"En annen italienske avis, Il Giornale, mener å vite at en overgangssum på 600 millioner kroner skal være nok til å prise Modric vekk fra Santiago Bernabeu.",Transfer
4618,"Ifølge TV 2 skal en mulig overgangssum ligge på over ti millioner kroner med bonuser og diverse. Daglig leder i Odd, Einar Håndlykken, bekrefter interessen.",Transfer
4619,"Etter det VG kjenner til, har Brann kommet med flere bud på Ranheims forsvarssjef gjennom sommeren. Etter søndagens 0–0-kamp mot Start gjenopptok partene samtalene, tirsdag ble det  enighet om en overgangssum og onsdag ble Eggen Rismark klar.",Transfer
4620,"Men ingen av de tre er midtstoppere, og det er nettopp der Mourinho har ønsket å styrke laget. Telegraph                        er blant avisene som skriver at Uniteds stopperjakt ikke handlet om vilje, men klubben ønsket ikke å bruke penger på noe annet enn en stopper av verdensklasse-kaliber. Raphael Varane var høyt på blokken, men ikke mulig å lokke
                        bort fra Real Madrid. Både Toby Alderweireld, Yerry Mina og Jerome Boateng skal ha hatt flere minuser enn plusser ved seg hva gjelder skadehistorikk, alder og overgangssum.",Transfer
4621,23-åringen blir verdens dyreste keeper for en overgangssum på 760 millioner kroner dersom han blir enig med London-klubben om de personlige betingelsene og består legesjekken.,Transfer
4622,Håland timer unna Salzburg-overgang: – Småting som gjenstår,Transfer
4623,Spurs-Pochettino skylder på Brexit for null overganger: – Vanskelig å synes synd på han,Transfer
4624,Norsk stortalent nær overgang til Premier League,Transfer
4625,ÅRÅSEN (VG) På et halvt år gikk Arnór Smárason (29) fra å være i den islandske landslagstroppen og ha startplass i Hammarby til benketilværelse i Sverige og sofaplass under VM. Derfor var en overgang til Lillestrøm en vinn-vinn-situasjon for islendingen. ,Transfer
4626,Norges Fotballforbund vil gå gjennom det som har skjedd i Sivert Heltne Nilsens overgang til Horsens.,Transfer
4627,"Vitesse håper å lande en Martin Ødegaard-overgang, men den nederlandske klubbens sportsdirektør innrømmer at det er en tøff dragkamp om nordmannen.",Transfer
4628,José Mourinho skal ha kalt Paul Pogba inn på teppet. Engelske aviser hevder franskmannen vil tvinge frem en overgang til Barcelona.,Transfer
4629,Rosenborg og Liverpool skal være enige om en overgang. Men Pedro Chirivella (21) sier nei. Spanjolen vil heller til en engelsk eller spansk klubb. Det skriver velinformerte Liverpool Echo.,Transfer
4630,"Odd-trener Dag-Eilev Fagermo går til angrep mot agent Atta Aneke etter John Kitolanos overgang til Wolverhampton. «Han sutrer over alt når det ikke går veien hans», svarer agenten.",Transfer
4631,Mange stusser over at Tottenham ikke gjorde én overgang i sommer. Tottenham-manager Mauricio Pochettino mener den nye stadionet og Brexit er årsaken. ,Transfer
4632,Det var under VM at Real Madrids kroatiske midtbanespiller Mateo Kovacic (24) uttalte at han så for seg en overgang bort fra klubben.,Transfer
4633,Norges Fotballforbund har gransket Sivert Heltne Nilsens overgang fra Brann til danske Horsens og kom i dag med sin konklusjon.,Transfer
4634,"Tirsdag ble det kjent at Norges Fotballforbund (NFF) skal granske Sivert Heltne Nilsens (26) overgang til danske Horsens. De vil se om Brann har hatt en muntlig avtale om å selge ham hvis det kom et godt nok bud, noe som strider mot regelverket.",Transfer
4635,Det var BA som først meldte at Start-keeperen nærmer seg en overraskende overgang til Brann og tirsdag ettermiddag ble nyheten bekreftet av Brann selv. ,Transfer
4636,"Etter at Håland i juni egenhendig senket serieleder Brann med fire scoringer, har spekulasjonene rundt en overgang til utlandet vokst. Sannsynligvis skjer det før vinduet stenger 1. september.",Transfer
4637,"Etter det VG kjenner til, har både Rosenborg og Molde over en periode signalisert interesse for den sentrale midtbanespilleren, men en overgang innad i Norge skal både Mathew og hans representanter ha stemplet som uaktuelt, og nå er det norske overgangsvinduet to dager unna stengning (når førstkommende onsdag går over i torsdag). Det vil si at norske klubber som skal kjøpe, må handle før midnatt 16. august, men salg ut fra Norge er gjennomførbart ut måneden.",Transfer
4638,Ifølge Fædrelandsvennen blir han hentet for rundt 10 millioner kroner – som er omtrent det samme som sørlendingenes dyreste overgang noen gang. I 2006 kom Ygor til klubben for den summen. TV 2 antar at summen for Akinyemi er litt lavere.,Transfer
4639,30-åringen spiller midtbane og vil erstatte Sivert Heltne Nilsen som forsvant til Hobro – en overgang som skapte mye støy rundt serielederen. ,Transfer
4640,På tampen av overgangsvinduet ble både Yerry Mina (overgang) og André Gomes (lån) hentet fra Barcelona.,Transfer
4641,Etter det TV 2 erfarer er Odd og den nyopprykkede Premier Leauge-klubben så godt som enige om en overgang for den talentfulle forsvarsspilleren.,Transfer
4642,Bare to minutter senere skulle vondt bli til verre for hjemmelaget. Christian Eriksen ble spilt fri ute på Tottenhams høyreside. Med et presist innlegg fant han Lucas Moura som hamret inn Tottenhams andre scoring. ,Goal/Assist
