,text,label
2902,"Nesten drømmestartI en jevn først omgang var hjemmelaget nær ved å få en drømmestart allerede etter to minutters spill. Måltyven Kristian Fardal Opseth sto bak den gode avslutningen som Odd-midtstopper Steffen
                        Hagen reddet på streken.",sjanse
2903,Gjestenes keeper Sondre Rossbach var utspilt ved den anledningen.,irrelevant
2904,"Det skulle vise seg å bli kampens to eneste scoringer. De siste 45 minuttene på Aspmyra var ikke særlig innholdsrike var gjelder sjanser, men med sju minutter igjen testet hjemmelagets Philip Zinckernagel skuddfoten fra litt skrå vinkel.",irrelevant
2905,"Odd-keeper Rossbach reddet sterkt. Glimt kom også til et par farlige avslutningsmuligheter på tampen, men avslutningene ble blokkert av Odd-forsvaret.",sjanse
2906,Tipster gir deg ferske tips - hver dag,Ignore
2907,Det skal være snakk om timer før Moldes brennhete spiss Erling Braut Håland (18) blir bekreftet klar for RB Salzburg.,Transfer
2908,"Ifølge VGs opplysninger forventer man i Molde å gjennomføre salget av Håland, som kan ha en totalramme på hele 100 millioner kroner, i løpet av mandag ettermiddag eller tirsdag.",Transfer
2909,– Ble dere enige om en kontrakt?,quote
2910,"– Vi har jo ikke skrevet under, så sånn sett er vi ikke enige. Vi har en positiv dialog, men ingenting er underskrevet. Vi har vært der og forhandlet, men det gjenstår en hel del, sier Alfi Håland til VG.",quote
2911,"– Vi nærmer oss en overgang som vi håper og tror at går i orden i løpet av kort tid. Vi er veldig nærme å få til dette, men det er ikke i orden før alle parter har signert. Det er noen småting som gjenstår, men vi håper og tror at det går veien, sier Neerland til VG.",quote
2912,"– Vi ønsker å få det på plass veldig fort nå. Det er et poeng å få det klarert før torsdag, sier Neerland.",quote
2913,– Kommer han til å bli lånt tilbake til Molde?,quote
2914,"– Vi kan ikke konkludere 100 prosent før alt er på plass, men vi jobber for å få til et tilbakelån. Så får vi konkludere når avtalen er i orden, sier Molde-direktøren.",quote
2915,Alfi Hålands svarer noe unnvikende på spørsmål om de ønsker et tilbakelån til Molde.,irrelevant
2916,"– Ting må diskuteres. Det er ikke helt avklart ennå, sier han.",quote
2917,VG spurte Erling Braut Håland om den mulige Salzburg-overgangen etter Brann-kampen søndag kveld. Slik svarte unggutten:,irrelevant
2918,Dermed fortsetter Manchester City der de slapp. Den regjerende mesteren står med full pott etter runde én. ,Club details
2919,"Ings var stor stjerne i nettopp Burnley, før han signerte for Liverpool for tre år siden. En rekke store skader har bidratt til at spissen med én landskamp for England ikke har slått skikkelig til på Anfield.",Transfer
2920," ​Se hvordan Manchester United tapte mot Brighton i videovinduet øverst!

",Ignore
2921,"Se scoringene i Sportsnyhetene i vinduet øverst!
",Ignore
2922,"– Ja, konstaterer Pep Guardiola.",quote
2923,VG LIVE: Les fullstendig kampreferat!,Ignore
2924,Pablo Sarabia sendte Sevilla i ledelsen etter bare ni minutter. Spanjolen ble spilt fri av Luis Muriel før han plasserte ballen kontrollert i det lengste hjørnet bak Marc-Andre ter Stegen. ,Goal/Assist
2925,"Tolv minutter før full tid kom altså avgjørelsen, med Dembélés drømmetreff, som ga Barcelona en fin start på sesongen.",Goal/Assist
2926,"Barcelona skulle imidlertid slå tilbake etter 42 minutters spill. Det er nesten alltid farlig når Messi stiller seg opp for å ta frispark, og dette forsøket var intet unntak. ",Goal/Assist
2927,"Argentineren – som nå er Barcelonas kaptein – gikk for skudd i keeperhjørnet, men traff stolpen. På returen var imidlertid Gerard Pique, som enkelt satte ballen i det tomme buret. ",Goal/Assist
2928,"Godset reduserte til 1–2 ved Kristoffer Tokstad, etter en stuss fra nettopp Pedersen. Da var håpet tent for drammenserne, og det var Bjørn Petter Ingebretsens menn som styrte showet etter pause. ",Goal/Assist
2929,"Men det var Philip Zinckernagel som åpnet ballet for vertene. Han stanget ballen i mål på lekkert vis, takket være to ting: ",Goal/Assist
2930,"Odds gigantiske mulighet på en corner etter bare to minutters spill viste prov på hva som skulle komme hjemme mot Strømsgodset. De tok ledelsen etter tolv minutter ved Espen Ruud, før Torgeir Børven endelig skulle få fart på sakene. ",Goal/Assist
2931,"Da han sa det, sto han med to mål på ni kamper for Skien-klubben. Mot Strømsgodset scoret han sitt tredje med et vakkert hodestøt etter et strålende Elba Rashani-innlegg. Det var en scoring som så ut til å kunne bli den avgjørende.",Goal/Assist
2932,Bodø/Glimt høvlet over Kristiansund på hjemmebane,irrelevant
2933,(Bodø/Glimt – Kristiansund 3–0) Et Bodø/Glimt i poengnød fikk maks uttelling hjemme mot Kristiansund.  ,Club details
2934,"I øspøsende regnvær på Aspmyra stadion, tok Bodø/Glimt sin første seier – og tre etterlengtede poeng – på eget kunstgress på over to måneder. Forrige gang de kunne juble for hjemmeseier var da de høvlet over Ranheim og vant 4–0.",Club details
2935,"Da Kristiansund kom på besøk, kunne bodøværingene igjen feire tre poeng. Og det kommer godt med for gultrøyer som før dagens kamp, bare var to poeng over nedrykksplass. ",Club details
2936,"1. Et perfekt vektet innlegg fra Thomas Jacobsen.2. Svakt markeringsspill av Kristiansund, som lot Zinckernagel gå opp helt upresset. ",irrelevant
2937,Slikt blir det scoring av. ,irrelevant
2938,Pedersen sentral i Strømsgodset-opphenting: – Jævlig bittert,Player details
2939,"(Odd – Strømsgodset 2–2) Marcus Pedersen (28) var i hovedrollen da Strømsgodset snudde 0–2 til 2–2 borte mot Odd. Til tross for en ellevill 2. omgang, var ikke Eliteseriens toppscorer helt fornøyd.",Player details
2940,"– Det har vært tungt, skuffende og irriterende, har Torgeir Børven tidligere sagt til VG om sin form siden Odd-returen. ",quote
2941,"Men etter at Odd-fansen hadde tatt farvel med Wolves-klare John Kitolano i pausen, måtte de også si farvel til ledelsen de hadde. ",irrelevant
2942,Da våknet nemlig Marcus Pedersen.,irrelevant
2943,"– Det er jævlig bittert at vi ikke vinner, sa han etter kampen. ",quote
2944,Nå står han med 14 mål på 17 kamper denne sesongen. ,Player details
2945,"Like etter var Pedersen farlig igjen, og nok en gang fant han veien til mål. Da var uansett flagget oppe for offside. ",sjanse
2946," – Jeg er fornøyd med at vi kommer tilbake, men det er ikke offside på målet mitt og vi har nok sjanser til å score flere, så litt irritert er jeg, sa han etter kampen.",quote
2947,"Dermed endte det med uavgjort på Skagerak Arena, etter en råsterk Godset-opphenting i den andre omgangen. ",irrelevant
2948,Vitesse venter på Ødegaard-svar,irrelevant
2949,"De siste dagene har Vitesse seilt opp som en het kandidat til å få låne Ødegaard fra Real Madrid, men det er ikke gitt at det blir slik.",Transfer
2950,"– Vi kommer til å ha kontakt de kommende dagene. Det er ikke lett, for det er mange klubber som er interessert i ham, men vi håper fortsatt at han kommer til Vitesse, sier sportsdirektør Marc van Hintum til avisen De Telegraaf.",quote
2951,Det var Nettavisen som omtalte saken først.,irrelevant
2952,Fredag snakket Vitesse-trener Leonid Slutskij om interessen for Ødegaard.,Transfer
2953,"– Vi får se, dersom han ikke har signert en kontrakt så er det ikke offisielt. Jeg håper at det blir offisielt, sa russeren til FOX Sports.",quote
2954,"Ødegaard har tidligere spilt på lån i en annen klubb i den nederlandske æresdivisjonen, nemlig Heerenveen.",Player details
2955,Bernardo Silva ville ikke være dårligere i den andre omgangen. Han fyrte av en rakett og sørget for at resultatet endte 2–0.,Goal/Assist
2956,"Simon Alexandersson var aller nærmest en redusering syv minutter før full tid, men en fantastisk redning av Ricardo i Glimt-buret, hindret et tent KBK-håp.",sjanse
2957,"Det ble ikke noen scoringer til KBK, men Glimt skulle få én til. Først bommet Jose Angel på straffe, men like etter spilte Håkon Evjen Geir André Herrem fri som satte inn 3–0 like før full tid. ",Goal/Assist
2958,"Tidligere i uken fikk Palace-fansen en opptur da lagets desiderte stjernespiller, Wilfried Zaha, signerte en ny femårskontrakt med klubben.",Transfer
2959,"Kampuret viste da bare tolv minutter, og allerede da hadde vi fått flere store sjanser ved Daouda Bamba og Amor Layouni. Da ingen av de klarte å finne nettmaskene, viste Glimts toppscorer hvordan det skal gjøres. ",irrelevant
2960,Det var hans syvende scoring denne sesongen.,Player details
2961,Dermed tre viktige – og fortjente – poeng til Bodø/Glimt. ,irrelevant
2962,"Hjemmelaget øker dermed luken til nedrykksplassen fra to til fire poeng, og har fått noe å bygge videre på. Det kommer godt med når deres neste motstander er Odd. ",Club details
2963,For Kristiansunds del venter Rosenborg i neste runde. ,irrelevant
2964,Hovland: – Vi er heldige som får med oss ett poeng,quote
2965,"TRONDHEIM (VG) (Rosenborg-Stabæk 1–1) Molde serverte en real gavepakke til trønderne, men et haltende Rosenborg-lag greide ikke å levere hjemme mot Stabæk.",irrelevant
2966,"Da Molde og Erling Braut Håland igjen slaktet serieleder Brann, ga de samtidig Rosenborg en stor mulighet til å innta tabelltoppen alene. Men Rosenborg snublet hjemme mot bunnlaget Stabæk søndag kveld.",irrelevant
2967,"– Det er langt under der vi skal være. Og vi er heldige som får ett poeng. Vi orker ikke nok. Det er skuffende at vi er sånn. Nå må vi brette opp ermene, for dette skal vi ikke være bekjent av, sier Rosenborg-midtstopper Even Hovland, til VG.",quote
2968,Sammen med stopperkollega Tore Reginiussen hadde han store problemer med å stoppe Stabæks lynving Franck Boli. Etter kampen satt de to midtstopperne på innbytterbenken i flere minutter.,irrelevant
2969,"– Vi snakket om at vi er skuffet. Vi er ikke fornøyde i det hele tatt med å ikke slå Stabæk. VI tok en liten prat om at vi må komme oss videre fortest mulig. Vi får ikke gjort noe med dette nå. Vi var oppgitte over at vi ikke greide å levere bedre, det var ikke mer enn dét.",quote
2970,"Rosenborg-trener Rini Coolen mente uavgjort var et fortjent resultat. Hjemmelaget hadde ballen mest, men det var bortelaget som skapte flest sjanser, de fleste på kontringer.",irrelevant
2971,"– Jeg er skuffet over spillet, for vi kan spille bedre. Men jeg må være realistisk, for det var ikke noe mer energi igjen til slutt. Spillerne kjempet, og det er jeg fornøyd med, men vi kan spille bedre, og det kommer vi til å gjøre, sier Coolen til VG.",quote
2972," Se Crystal Palace-Liverpool på TV 2 Sport Premium og TV 2 Sumo mandag fra klokken 20.30 ​

",Ignore
2973,"På fotballbanen blir 32-åringen uansett bedre og bedre år for år. Forrige sesong satte han assistrekord med hele ni målgivende pasninger i Champions League. Selvsagt åpnet han også inneværende sesong med assist til Sadio Manés 2-0-scoring
                        mot West Ham sist helg.",Goal/Assist
2974,"Ledelsen ble doblet av Kristoffer Zachariassen med et drøyt kvarter igjen. På 14–15 meter fikk midtbanespilleren ballen perfekt servert av Jon-Helge Tveita, bredsidet ballen elegant opp i hjørnet bak Marko Maric.",Goal/Assist
2975,Og bergenserne trengte bare fem minutter til å ta ledelsen mot østfoldingene.,Goal/Assist
2976,"Det tok nesten femti minutter før Rosenborg greide å spille seg til en stor scoringssjanse. Men Jonathan Levi chippet over både keeper og mål, fra god posisjon.",sjanse
2977,"Stabæks lynving var en konstant trussel mot Rosenborgs midtstopperduo. Mer enn én gang ble Rosenborg reddet av André Hansen, som hindret flere Boli-scoringer.",sjanse
2978,"– Spillemessig var dette den beste kampen vi har gjort så langt, under meg. Vi kunne ha scoret flere mål.",quote
2979,– Er du skuffet over ett poeng?,quote
2980,"– Litt skuffet er jeg, når man ser de sjansene vi hadde. Vi forsvarte oss dypt, og Rosenborg hadde mye ball, uten at de greide å skape så mange sjanser. Så jeg skulle gjerne sett at vi hadde vunnet kampen.",quote
2981,"Sju minutter ut i omgangen kjørte Njie karusell med høyreback Eggen Hedenstad. Njie tok seg helt ned til dødlinja, og la pasningen utover. Der ventet Franck Boli, banens bestemann, med yttersiden av foten; og ballen helt oppe i Hansens nærmeste kryss.",Goal/Assist
2982,"Etter ledermålet ventet ikke Rosenborg-trener Coolen lenge med å gjøre grep. Erik Botheim kom inn for Gersbach, og fikk operere i en fri rolle på offensiv midtbane; i en slags tier-rolle",irrelevant
2983,"Flere mål bel det ikke. Dermed har Rosenborg ett poeng opp til Brann, mens Molde kommer i en fart bakfra.",Club details
2984, Se reportasje i videovinduet øverst.,Ignore
2985,"Debutant Jebali fant innbytter Anders Konradsen, som avsluttet og tvang Sean McDermott til å gi en retur.",sjanse
2986,"Anders Konradsen sørget for RBK-ledelse, mens Jebali kronet en god debut med å sette inn kveldens andre.",Goal/Assist
2987,Drømmedebut for RBKs nysignering,irrelevant
2988,Issam Jebali sentral da Rosenborg slo Kristiansund.,irrelevant
2989,Kristiansund-Rosenborg 0-2,Ignore
2990,"Rosenborg spilte ingen stor kamp, men nysigneringen Issam Jebali viste seg frem og bidro til at trønderne reiste hjem fra Kristiansund med alle tre poengene.",Club details
2991,"Rosenborg ligger fortsatt ett poeng bak serieleder Brann, som også vant sin kamp mot Sarpsborg søndag kveld.",Club details
2992,"Haugesund og Molde på plassene bak avga poeng, og er henholdvis seks og åtte poeng bak bergenserne.",Club details
2993,"Det var lenge en jevnspilt kamp, der vertene klarte seg vel så bra som sine langt mer meritterte gjester.",irrelevant
2994,"Mot slutten av første omgang Dan Petter Ulvestad en gyllen mulighet etter en corner, men lagene gikk til pause på 0-0.",sjanse
2995,"Utover i andre omgang fester Rosenborg grepet mer og mer, og etter 65 minutters spill satt den for trønderne.",Goal/Assist
2996,VG Live: Les fullstendig kampreferat her,Ignore
2997,– Hva sa manager Hughes til deg etter kampen?,quote
2998,Sju minutter senere doblet gjestene ledelsen på vakkert vis.,Goal/Assist
2999, Se scoringene øverst,Ignore
3000,"Målshowet startet allerede etter tre minutter, da Erling Braut Håland skaffet straffe og scoret på den selv. Så smalt han en ball i stolpen og en i nettveggen før 20 minutter var passert. ",Goal/Assist
3001,Etter en vanvittig kjøpefest på siste dag av overgangsvinduet styrket Brann troppen før innstpurten i gullkampen.,Transfer
3002,"– Det var selvfølgelig veldig deilig. Det var en tøff kamp i dag, med litt mye rot i begge ender. Målet sto i stil til resten av kampbildet. Det var ikke verdens vakreste, men det er fortsatt like viktig og det hjalp til at vi fikk
                        litt lavere skuldre og fikk bedre kontroll på kampen, sier Konradsen til TV 2.",quote
3003,"Birger Meling fant Jebali ute på venstrekanten. Han tok seg inn i boksen, dro seg forbi en KBK-forsvarer og kronet debuten ved å på vakkert vis curle ballen i lengste fra skrått hold.",Goal/Assist
3004,"To minutter før full tid ble målscoreren byttet ut, og erstattet med Rosenborgs andre nysignering i sommervinduet - serberen Djordje Denic (22).",irrelevant
3005,Brann vant toppkampen,Club details
3006,Lars Arne Nilsen og Brann tok en kontrollert seier over Sarpsborg 08 med nyervervelsene Daouda Bamba og Ruben Yttergård Jenssen på benken.,Club details
3007,Brann - Sarpsborg 08 2-0,Ignore
3008,"Men mot Sarpsborg 08 valgte Lars Arne Nilsen å starte med nysigneringene Christian Eggen Rismark, Ruben Yttergård Jenssen og Daouda Bamba på benken. Det var kun Thomas Grøgaard som fikk tillit fra start av spillerne som nettopp har
                        kommet til Bergen.",Club details
3009,"Brann holder fremdeles unna på toppen av tabellen, selv om Rosenborg ligger hakk i hæl.",Club details
3010,"Bergenserne leder tabellen med ett poeng foran Rosenborg, og seks poeng foran Haugesund på tredjeplass.",Club details
3011,"– Det var en tett og jevn kamp hvor Brann var mest effektive. De har hentet mange spillere, og de blir spennende å se om de klarer å holde trykket oppe hele sesongen, sa Raymond Kvisvik i FotballXtra på TV 2.",quote
3012,Slik startet lagene:,irrelevant
3013,VG Live: Les fullstendig kampreferat her!  ,Ignore
3014,"Men det var hjemmelaget som skapte de største sjansene. Gilbert Koomson var bare centimetere fra å øke ledelsen til 2-0 for rødtrøyene, men headingen strøk utsiden av stolpen.",sjanse
3015,Leckaj scoret et av målene i 3–0-seieren. Han feiret sin scoring foran bortesupporterne fra Moss,Goal/Assist
3016,"Andreas Aalbu og Joona Veteli scoret de andre målene for FFK. Aristokratene ligger på 2. plass, tre poeng bak serieleder Raufoss i sin 2. divisjonsavdeling. ",Goal/Assist
3017,Marko Grujić går på lån ut sesongen.,Transfer
3018,"– Det er helt åpent dette. Sarpsborg har et godt nok lag til å slå tilbake, sa Raymod Kvisvik i FotballXtra på TV 2.",quote
3019,Doblet ledelsenDet utviklet seg til å bli en sjansefattig affære mellom de to topplagene. Dermed gikk lagene til pause på stillingen 1-0 til Brann.,irrelevant
3020,"Ruben Yttergård Jenssen og Daouda Bamba ble byttet inn med 20 minutter igjen av kampen, til stor begeistring fra hjemmefansen. Ingen av nykommerne klarte å sette sitt preg på kampen.",Player details
3021,"Kampen endte 2-0 til rødtrøyene, og Brann holder unna for Rosenborg, som vant 2-0 over Kristiansund.",Club details
3022,BRANN (4-3-3): Sahin-Radlinger - Teniste - Acosta - Wormgoor (K) - Grøgaard - Barmen - Orry Larsen - Haugen - Rolantsson - Lie Skålevik - Koomson.,irrelevant
3023,SARPSBORG 08 (4-4-2): Vasiutin - Tveita - Utvik - Tamm - Thomassen - Halvorsen - Singh - Zachariassen - Larsen - Mortensen - Strand Larsen.,irrelevant
3024,"«Nye Arsenal» senket av City: – Kom tilbake, Arsène!",Club details
3025,(Arsenal – Manchester City 0-2) Regjerende seriemester Manchester City fortsetter der de slapp. Tittelutfordrer Arsenal ble slått 2–0 på bortebane i PL-åpningen.,Club details
3026,For første gang siden 1997/98-sesongen sto en annen manager enn Arsène Wenger (ankom september 1996) på sidelinjen i en sesongåpning for Arsenal. ,irrelevant
3027,"Prosjekt Unai Emery kunne imidlertid ha håpet på en bedre start, for da pipeblåser Michael Oliver blåste for 90 minutter på Emirates, sto det 2–0 i favør Manchester City på måltavlen.",irrelevant
3028,"– Når du spiller mot et lag med Citys kvaliteter og selvtillit, blir det alltid vanskelig. Man kan ikke gjøre mange tabber, sier Petr Cech, som var svært nær ved å score selvmål da han sentret et tilbakespill bakover og like utenfor egen stang.",quote
3029,"– Det er synd at vi ikke klarer å avslutte kontringene våre. Samlet sett er vi skuffet over tapet, fortsetter han.",quote
3030,"Dette var Unai Emerys første tellende kamp som Arsenal-manager, og TV 2-kommentator Simen Stamsø Møller lot seg ikke imponere veldig.",irrelevant
3031,"I det 86 minutt fikk Moi en god mulighet inne i feltet, men ble taklet av James Tarkowski i avslutningsøyeblikket, og måtte nøye seg med en corner det ikke ble noe av. ",sjanse
3032,"David Silva markerte seg med et praktfullt frisparkmål fra 20 meter tidlig i andre omgang, før han ble byttet ut til stående ovasjoner etter 64. minutter.",Goal/Assist
3033,"De scoret i hver sin omgang, begge på pasning fra Benjamin Mendy.",Goal/Assist
3034,VG Live: Referat fra kampen,Ignore
3035,VG Live: Les utfyllende referat her!,Ignore
3036,Moi fikk Premier League-debuten for Southampton: – Føler at det ble «bare nesten»,Player details
3037,"– Jeg følte at jeg fikk vist meg frem litt, satt litt fart og prøvd på ting. Det var en godkjent start for min del, men selv er jeg ikke helt fornøyd. Jeg skulle hatt scoring eller assist, sa Elyounoussi da han møtte VG en times tid etter kampslutt i regnværet utenfor St. Mary’s Stadium.",quote
3038," I går fikk Stefan Johansen sin Premier League-debut for Fulham, og i dag ble Elyounoussi nordmann nummer 69 som har spilt i den engelske toppserien. Han ble samtidig den sjette som har fått obligatorisk ligakamp for Southampton.",Player details
3039,I det 56. minutt hadde manager Hughes sett nok av et tamt hjemmelag som med en god porsjon flaks hadde holdt nullen mot Burnley.,irrelevant
3040,Hughes tok en liten «peptalk» med Moi i sekundene før han entret banen.,irrelevant
3041,"– Han ba meg bare spille mitt spill og ha det morsomt. Det var betryggende, og jeg gjorde som han sa – jeg koste meg.",quote
3042,"Mark Hughes fremhevet også byttene, og Mois innsats i intervjuene etter kampen: ",irrelevant
3043,"– Med Mois tekniske ferdigheter og viljen til å utfordre, så har vi et ekstra element med offensivt trykk som vi har manglet tidligere, sa Hughes. ",quote
3044,"Danny Ings, lånt inn for sesongen fra Liverpool, kom inn for Stuart Armstrong. Moi erstattet høyreback Cedrick Soares, og la seg i en offensiv rolle på venstrekanten.",Transfer
3045,Og han var godt synlig i en kamp der underholdningsverdien totalt sett ikke var all verden. ,irrelevant
3046,"Elyounoussi ble tidlig taklet knallhardt av Matthew Lowton, men viste nok til at han bør være aktuell for en plass fra start i bortekampen mot Everton neste helg. ",irrelevant
3047,"Og han hadde da også muligheten til å bli den store, store helten. ",irrelevant
3048,"– Jeg måtte ta et touch for å dra ham vekk. Jeg hadde lyst til å ta den på utsiden og skyte med høyre, men ombestemte meg i siste liten. Jeg var litt ute av balanse og brukte litt mye tid, forklarte Elyounoussi.",quote
3049,"– Jeg håper dette var nok til å få bidra minst like mye fremover, oppsummerte den tidligere Basel, Molde og Sarpsborg 08-spilleren. ",quote
3050,"–  Jeg synes Arsenal har mange av de samme syndromene som forrige sesong. De har spillere som ødelegger ganske mye. Cech sprer ikke trygghet, og Xhaka er teknisk dårlig fortsatt. Det gjør at de ikke får angrepet mer enn de gjør, mener han. ",quote
3051,"– Kom tilbake, Arsène! Samme gamle Arsenal idet Emerys menn gikk på tap mot City, skriver Daily Mail på sine nettsider.",quote
3052,"Men selv om det ikke gikk veien, er det ingen grunn til å gi opp prosjektet, mener Gary Lineker.",irrelevant
3053,Manchester City-seieren sørget Raheem Sterling og Bernardo Silva før.,irrelevant
3054,"Raheem Sterling dro seg innover fra venstre, gikk i overkant lett forbi Hector Bellerín og Matteo Guendouzi før han plasserte ballen til venstre for en noe passiv Petr Cech (valgt på bekostning av sommerkjøpet Bernd Leno).",Goal/Assist
3055,Det var 23 år gamle Raheem Sterlings 50. Premier League-mål.,Player details
3056,– Den perfekte start?,quote
3057,"– Med tanke på der vi er i sesongen, med flere spillere som ikke er helt klare fysisk, en fantastisk god prestasjon, fortsetter City-manageren, og melder at eget lag kommer til å bli «bedre og bedre for hver dag».",quote
3058,PS: Neste runde venter Huddersfield på hjemmebane for Manchester City. Arsenal møter Chelsea borte.,Club details
3059,FrisparkperleOg festen var på ingen måte over. To minutter ut i andreomgangen banket David Silva inn hjemmelagets fjerde scoring på et fantastisk frispark.,Goal/Assist
3060,Først lobbet han inn ledermålet på utsøkt vis etter 25 minutter. Deretter var han nådeløs og satte inn sitt andre mål for dagen med ti minutter igjen av førsteomgangen.,Goal/Assist
3061,"Keepertabbe og reduseringSelv om City regelrett maltrakterte Huddersfield i banespillet, fikk de hjelp av gjestene. Ben Hamer skulle bare plukke opp et innlegg som ble slått
                        inn i feltet, men presterte på merkelig vis å miste ballen. Agüero var årvåken og straffet sisteskansen knallhardt med å sette inn sitt andre mål for dagen.",Goal/Assist
3062,"Femten minutter før slutt satte argentineren inn sitt tredje mål for dagen, og sikret seg dermed sitt niende hattrick for Manchester City i ligaen.",Goal/Assist
3063,"30-åringen drev tidvis Huddersfield-forsvarerene til vanvidd med sin enorme fart og styrke, og scoret hattrick da «The Citizens» tok sesongen andre seier.",Goal/Assist
3064,Han ble tidenes dyreste norske spiller da Southampton hentet ham fra Basel for 190 millioner kroner i juli. ,Transfer
3065,Agüero med klassescoring da Manchester City serverte festfotball,Goal/Assist
3066,Sergio Agüero ble den store spilleren med hattrick da Manchester City feide Huddersfield av banen.,Player details
3067,Manchester City - Huddersfield 6-1,Ignore
3068,Sergio Agüero var tilbake i storslag etter et skuffende verdensmesterskap for Argentina.,Player details
3069," Se samendraget øverst 
",Ignore
3070,Fantomkampen mot Huddersfield gjør at Agüero nå har scoret 146 mål for Manchester City i Premier League etter han kom fra Atlético Madrid i 2011.,Player details
3071,"– Han blir aldri mett på scoringer. Han jakter hele tiden nye triumfer. For en fantastisk fotballspiller Agüero er, sa TV 2s kommentator Kasper Wikestad.",quote
3072,Manchester City vant 6-1 i det som var en parademarsj fra første minutt. Dermed har Pep Guardiola fått en perfekt start på sesongen med full pott på to kamper.,Club details
3073,Slik var kampen:De regjerende Premier League-mesterne gikk ut i et forrykende tempo mot Huddersfield på Etihad Stadium.,irrelevant
3074,"Allerede etter fire minutter hadde blåtrøyene skapt fire muligheter, og størst av dem alle var det David Silva som sto bak.",sjanse
3075,"Spanjolen la inn til Gabriel Jesus som på utrolig vis ikke greide å stokke beina, og avslutningen fra tre meter gikk rett på Huddersfield-målvakt Ben Hamer.",sjanse
